file_name,Ticker,Year,Quarter,sentence,keyword,category,finbert_positive,finbert_negative,finbert_neutral,vader_positive,vader_negative,vader_neutral,flesch_reading_ease,gunning_fog_index,smog_index,lexical_density,word_count,named_entity_count
UVE_2Q17.pdf,UVE,2017,2Q,"To further inflate itself for future years, UPCIC has also now successfully secured over $300 million of
catastrophe capacity with contractually agreed limits that extend for 2 or more years.",catastrophe,Financial,0.9999974966049194,6.083912751364551e-08,2.4155744995368877e-06,0.255,0.115,0.63,32.57,17.33,0.0,0.9666666666666667,30,4
UVE_2Q17.pdf,UVE,2017,2Q,"American Platinum
was also able to continue the conservatism trend by utilizing the same percentage of premium spent on
reinsurance to add coverage for its new commercial lines business to all contracts and also maintain the
same $2 million catastrophe retention.",catastrophe,Financial,0.9999995231628418,1.566124119278811e-08,4.727957332306687e-07,0.0,0.099,0.901,21.4,26.16,0.0,0.8536585365853658,41,2
UVE_2Q17.pdf,UVE,2017,2Q,"Ceded premiums earned
as a percentage of direct premiums earned was 31% during both the second quarter of '17 and '16.
Commission revenue of $4.6 million for the quarter grew 10.3% compared to the same quarter in 2016,
reflecting the differences in our reinsurance programs in effect during those periods, including an increase
in our exposures covered by the reinsurance.",reinsurance,Financial,0.9999953508377075,1.1738435290453708e-07,4.496621386351762e-06,0.038,0.0,0.962,56.25,12.0,12.6,0.75,60,8
UVE_2Q17.pdf,UVE,2017,2Q,"Additionally, the second quarter of 2017 included prior year reserve development of $1.1 million, 0.7
points on the loss and LAE ratio, driven by additional losses for Hurricane Matthew, while the second
quarter of '16 included a negligible amount of prior year reserve development.",hurricane,Climate,0.001009213039651513,0.06415808945894241,0.9348326921463013,0.0,0.109,0.891,39.63,11.33,12.5,0.75,44,8
UVE_2Q17.pdf,UVE,2017,2Q,"It looks like your reported a gross Hurricane Matthew loss of
$38 million and you have a retention of $35 million.",hurricane,Climate,9.754821803653613e-06,0.8154102563858032,0.1845800131559372,0.105,0.226,0.669,67.08,14.11,0.0,0.9047619047619048,21,3
UVE_2Q17.pdf,UVE,2017,2Q,"So in the
example of Hurricane Matthew, at present, we are expecting a recovery from that supplemental Other
States program of $7.7 million, which serves to reduce our overall retention from $35 million down to
$27.3 million.
",hurricane,Climate,4.549734512693249e-05,0.9997907280921936,0.00016382425383199006,0.0,0.0,1.0,61.16,13.89,0.0,0.918918918918919,37,4
UVE_2Q18.pdf,UVE,2018,2Q,"This includes
weather losses above expectations of $5 million or 2.6 points, as well as $2.3 million or 1.2 points of
adverse reverse development, primarily related to Hurricane Matthew.",hurricane,Climate,0.8738372921943665,0.07115960121154785,0.05500320717692375,0.063,0.156,0.781,55.61,9.82,9.5,0.8620689655172413,29,5
UVE_2Q18.pdf,UVE,2018,2Q,"Our
service company subsidiaries continue to produce benefits in the aftermath of Hurricane Irma, as Universal
Adjusting Corporation and Blue Atlantic Reinsurance Corporation contributed $8.4 million and $0.9 million,
respectively, to second quarter results.",reinsurance,Financial,0.9999988079071045,9.244898535598622e-08,1.0346141152695054e-06,0.135,0.0,0.865,17.71,16.28,14.6,0.9117647058823529,34,6
UVE_2Q18.pdf,UVE,2018,2Q,"We are protected by a comprehensive reinsurance program which we enhanced at the most recent mid-
year reinsurance renewal to include a digital conservatism, and our unique vertically integrated structure
positions us well to capitalize in the event of a disruptive industry event, as highlighted by our Hurricane
Irma performance, which continue to manifest itself favorably in the current quarter's results.
",reinsurance,Financial,1.0,1.0181546272747255e-08,1.4287845351290684e-09,0.148,0.035,0.817,-15.83,36.2,0.0,0.819672131147541,61,3
UVE_2Q18.pdf,UVE,2018,2Q,"I would like to first start with an update on Hurricane Irma and will also provide a brief
update on Hurricane Matthew, discuss the 2018 weather events to date and recap our updated reinsurance
program following the June 1 renewal.
",reinsurance,Financial,1.2778098152921302e-06,1.5598853906340082e-06,0.9999971389770508,0.065,0.0,0.935,39.34,20.0,0.0,0.85,40,5
UVE_2Q18.pdf,UVE,2018,2Q,"Following another 3 months of actively settling Hurricane Irma claims, we have increased our estimate of
gross losses related to Hurricane Irma to $600 million.",hurricane,Climate,0.13061244785785675,0.04144924506545067,0.8279381990432739,0.146,0.192,0.662,29.18,16.4,0.0,0.84,25,4
UVE_2Q18.pdf,UVE,2018,2Q,"We stress that this increase in gross losses for Hurricane Irma had a negligible change on our net
retention, which remains at approximately $29 million for the event.
",hurricane,Climate,0.008251901715993881,0.2111492156982422,0.7805989384651184,0.068,0.254,0.678,43.06,16.91,0.0,0.9642857142857143,28,2
UVE_2Q18.pdf,UVE,2018,2Q,"From a financial impact standpoint, we have now booked to a level that reaches the portion of our
reinsurance programs that we are now responsible for paying reinstatement premiums.",reinsurance,Financial,2.9293825718923472e-05,9.52736590988934e-05,0.9998754262924194,0.123,0.0,0.877,33.58,18.5,0.0,0.8620689655172413,29,0
UVE_2Q18.pdf,UVE,2018,2Q,"Specifically, for
any Hurricane Irma losses ceded to our traditional reinsurance program in excess of $595 million, we
will incur reinstatement cost of 9% for the first $193 million and 4.75% for the next $125 million.",reinsurance,Financial,0.0019673332571983337,0.012258635833859444,0.985774040222168,0.0,0.072,0.928,53.21,12.76,0.0,0.8888888888888888,36,7
UVE_2Q18.pdf,UVE,2018,2Q,"As a result of Hurricane Irma, the past 3 quarters have each included the benefit of additional revenues
within our service provider subsidiary, which led to higher -- to a higher level of profitability than would
otherwise be the case in a normal quarter.",hurricane,Climate,0.9999997615814209,1.5096625816113374e-07,7.77910003080251e-08,0.118,0.0,0.882,27.83,21.85,0.0,0.8181818181818182,44,3
UVE_2Q18.pdf,UVE,2018,2Q,"Blue Atlantic Reinsurance Corporation received $900,000
of reinstatement commissions during the second quarter of 2018 and Universal Adjusting Corporation
produced $8.4 million of pretax profit during the second quarter of 2018, the vast majority of which was
related to additional revenues created due to the continued increased workload as a result of Hurricane
Irma.
",reinsurance,Financial,0.9862673282623291,0.006025269627571106,0.007707487791776657,0.123,0.0,0.877,18.69,19.69,0.0,0.7592592592592593,54,7
UVE_2Q18.pdf,UVE,2018,2Q,Turning now to Hurricane Matthew.,hurricane,Climate,5.442370820674114e-05,0.00512797012925148,0.9948175549507141,0.0,0.0,1.0,66.4,10.0,0.0,1.0,5,1
UVE_2Q18.pdf,UVE,2018,2Q,"Second quarter 2018 results include $2.6 million or 1.3 points of net
unfavorable prior year reserve development related to Hurricane Matthew, which occurred in the fourth
quarter of 2016.",hurricane,Climate,8.902981790015474e-05,0.9361869692802429,0.06372401863336563,0.0,0.0,1.0,53.17,9.4,9.7,0.9310344827586207,29,6
UVE_2Q18.pdf,UVE,2018,2Q,"The prior year's quarter included $1.1 million or 0.7 points of net unfavorable prior year
reserve development, also related to Hurricane Matthew.
",hurricane,Climate,8.104390144580975e-05,0.9666000008583069,0.03331892937421799,0.0,0.0,1.0,47.15,12.01,10.5,0.9545454545454546,22,5
UVE_2Q18.pdf,UVE,2018,2Q,"As of June 30, 2018, the Hurricane Matthew incurred loss stood at $42.7 million with only 78 remaining
open claims.",hurricane,Climate,0.000400251941755414,0.1725437343120575,0.8270559906959534,0.0,0.108,0.892,78.25,8.0,0.0,1.0,20,2
UVE_2Q18.pdf,UVE,2018,2Q,"The net unfavorable prior year reserve development during this quarter is
related to a negotiation on a specific multiyear reinsurance treaty that resulted in our agreement to
cap losses ceded from Hurricane Matthew at $40 million growth for that particular reinsurance treaty in
exchange for favorable treatment on reinstatement cost going forward.
",reinsurance,Financial,0.042758774012327194,0.22274349629878998,0.7344977259635925,0.155,0.047,0.799,1.78,30.03,0.0,0.8461538461538461,52,4
UVE_2Q18.pdf,UVE,2018,2Q,"During the quarter, we completed our 2018, 2019 reinsurance programs for both of our insurance
companies and continue to build on the recent trend of adding additional conservatism to our reinsurance
programs without increasing the percentage of premium spent on reinsurance.",reinsurance,Financial,0.02081858366727829,7.450626435456797e-05,0.9791069030761719,0.0,0.0,1.0,12.94,26.16,0.0,0.7560975609756098,41,3
UVE_2Q18.pdf,UVE,2018,2Q,"Even with UPCIC's growing
business, we structured our catastrophe coverage in a similar manner and maintained the same $35
million catastrophe retention for our Florida losses and the same $5 million catastrophe retention for the
loss involving states other than Florida.
",catastrophe,Financial,0.00011919851385755464,1.5190564226941206e-05,0.9998656511306763,0.032,0.338,0.631,12.94,23.23,0.0,0.7560975609756098,41,5
UVE_2Q18.pdf,UVE,2018,2Q,"UPCIC also continue to purchase a contract to reduce its second, third, fourth and fifth event retention for
a catastrophe loss involving states other than Florida and expanded the top of its reinsurance tower for a
single event up to $3 billion.
",catastrophe,Financial,0.012168587185442448,0.002485424978658557,0.9853459596633911,0.04,0.151,0.809,28.85,23.47,0.0,0.8095238095238095,42,7
UVE_2Q18.pdf,UVE,2018,2Q,"With the manner in which UPCIC purchased its catastrophe coverage, in order for the company to utilize
all of this purchase limit, UPCIC would need to incur 2 events of nearly $2 billion or 3 events of $1.3 billion
or 4 events of $1 billion.",catastrophe,Financial,1.2687480193562806e-05,0.0025104950182139874,0.9974767565727234,0.0,0.097,0.903,65.56,10.78,0.0,0.7555555555555555,45,8
UVE_2Q18.pdf,UVE,2018,2Q,"In any of these catastrophe scenarios, the company would be responsible for its
retention up to a maximum of $35 million per even plus a onetime reinstatement cost not to exceed $24.8
million.
",catastrophe,Financial,0.0002781855873763561,0.0007260404527187347,0.9989957213401794,0.064,0.123,0.812,37.98,20.47,0.0,0.9090909090909091,33,2
UVE_2Q18.pdf,UVE,2018,2Q,"To further insulate itself for future years, UPCIC has also announced successfully secured over $365
million of catastrophe coverage with contractually agreed limits that extend for 2 or more years.
",catastrophe,Financial,0.9998944997787476,7.514280468967627e-07,0.00010478084004716948,0.255,0.115,0.63,24.11,18.67,0.0,0.9666666666666667,30,4
UVE_2Q18.pdf,UVE,2018,2Q,"American Platinum was also able to continue the conservatism trend by utilizing a lower percentage of
premium spent on reinsurance and adding coverage to the top end while maintaining the same $2 million
catastrophe retention.
",catastrophe,Financial,1.0,1.3640378604407033e-08,2.8505059646022346e-08,0.046,0.168,0.787,27.49,25.43,0.0,0.9142857142857143,35,2
UVE_2Q18.pdf,UVE,2018,2Q,"Second quarter of '18 results include $2.3 million or 1.2 points of unfavorable prior year reserve
development, primarily related to Hurricane Matthew, compared to $1.1 million or 0.7 points of
unfavorable development during the second quarter of '17.
",hurricane,Climate,0.00046256041969172657,0.7660486698150635,0.23348882794380188,0.0,0.0,1.0,46.84,8.3,9.9,0.7631578947368421,38,8
UVE_2Q18.pdf,UVE,2018,2Q,"The second quarter of '18 loss adjustment expenses include a benefit of $8.4 million or 4.4 points from
additional revenues earned by Universal Adjusting Corporation related to Hurricane Irma.",hurricane,Climate,0.9014402031898499,0.002320230007171631,0.09623953700065613,0.096,0.073,0.831,36.25,16.29,13.0,0.9655172413793104,29,5
UVE_2Q18.pdf,UVE,2018,2Q,"Our underlying
loss and LAE ratio increased compared to the prior year reflecting continued geographic expansion
as noncatastrophe loss ratios in our Other States book are generally higher than in Florida and the
marketplace dynamics within our home state of Florida, including the impact of AOB-related claims.
",catastrophe,Financial,0.9999760389328003,4.814037879441457e-07,2.3479275114368647e-05,0.081,0.089,0.83,-1.62,29.01,0.0,0.851063829787234,47,6
UVE_2Q18.pdf,UVE,2018,2Q,"And obviously, we are getting into hurricane season and sometimes you see an
increase there, it being a cyclical cycle where people buying insurance going into hurricane season, so I
think all those are contributing factors that contribute to that rate.
",hurricane,Climate,0.009276163764297962,0.25252625346183777,0.7381975054740906,0.057,0.0,0.943,21.4,21.28,0.0,0.9024390243902439,41,2
UVE_2Q18.pdf,UVE,2018,2Q,"We did save some money on our reinsurance
program relative to our expected earned premiums.",reinsurance,Financial,0.630527138710022,0.03213823214173317,0.3373345732688904,0.186,0.0,0.814,47.79,16.67,0.0,0.9333333333333333,15,0
UVE_2Q18.pdf,UVE,2018,2Q,"Do you get any pushback ever from your reinsurance partners on your ability to
generate income as the losses go up?
",reinsurance,Financial,0.012982449494302273,0.34501534700393677,0.6420021653175354,0.096,0.113,0.792,58.62,14.11,0.0,0.9523809523809523,21,0
UVE_2Q18.pdf,UVE,2018,2Q,"The difference would be the recoveries that we had from our Other
States catastrophe program that serve to offset the core retention.
",catastrophe,Financial,0.003717609215527773,0.015607672743499279,0.980674684047699,0.0,0.173,0.827,57.61,14.25,0.0,0.9090909090909091,22,1
UVE_2Q18.pdf,UVE,2018,2Q,"13Yes, we've had 16 claims reported to date, and given that the majority of those occurred in May, when we
had satisfied our otherwise recoverable on our aggregate program, we will have a reinsurance recovery
there.
",reinsurance,Financial,0.029689671471714973,0.01276326272636652,0.9575470089912415,0.076,0.0,0.924,34.94,22.18,0.0,0.9166666666666666,36,3
UVE_2Q18.pdf,UVE,2018,2Q,"And then, on the rate increases.",rate increases,Financial,6.19455604464747e-05,0.0007472854922525585,0.9991907477378845,0.0,0.0,1.0,90.77,9.07,0.0,1.0,6,0
UVE_2Q18.pdf,UVE,2018,2Q,"What are you guys putting in for rate increases for this year
in Florida and outside Florida?
",rate increases,Financial,6.6105558289564215e-06,6.985871732467785e-05,0.999923586845398,0.0,0.0,1.0,71.14,11.51,0.0,0.8823529411764706,17,3
UVE_2Q18.pdf,UVE,2018,2Q,"Well we are paying -- Blue Atlantic has paid reinsurance -- excuse me, reinstatement brokerage as losses
are billed and paid.",reinsurance,Financial,3.983596616308205e-05,0.000106266830698587,0.9998538494110107,0.141,0.112,0.747,52.19,13.92,0.0,0.9047619047619048,21,1
UVE_2Q18.pdf,UVE,2018,2Q,"So while we advise that we're booking Hurricane Irma to $600 million, we have not yet
billed or collected the $600 million.",hurricane,Climate,3.2214879865932744e-06,0.016612503677606583,0.983384370803833,0.0,0.0,1.0,66.07,12.44,0.0,0.9090909090909091,22,3
UVE_2Q19.pdf,UVE,2019,2Q,"We finalized our 2019 and 2020 reinsurance
programs, and we're able to secure more catastrophe coverage than at any other point in the history
of the company.",catastrophe,Financial,0.9999988079071045,3.114037383511459e-08,1.2222304803799489e-06,0.075,0.146,0.779,44.07,16.73,0.0,0.9259259259259259,27,2
UVE_2Q19.pdf,UVE,2019,2Q,"spglobal.com/marketintelligence 5Lastly, our digital insurance distribution channel, Clovered, continued its expansion, becoming licensed in
more than 15 states and added 5 additional carrier appointments across homeowners, auto, flood and E&S
lines.
",flood,Climate,0.9730077385902405,7.534413271059748e-06,0.026984697207808495,0.0,0.0,1.0,-2.3,26.59,0.0,0.967741935483871,31,4
UVE_2Q19.pdf,UVE,2019,2Q,"Prior year reserve development of $670,000 or 30 basis points was recorded for the quarter and $485,000
or 10 basis points was recorded for the first half of 2019 primarily related to increased net losses in LAE
for Hurricane Matthew.",hurricane,Climate,0.001373722800053656,0.5023829936981201,0.49624332785606384,0.049,0.063,0.888,39.34,20.0,0.0,0.775,40,9
UVE_2Q19.pdf,UVE,2019,2Q,"Total services revenue increased 5.3% to $13.8 million for the quarter and 4.1% to
$26 million for the first half of 2019, driven by commission revenue earned on ceded premiums by our
reinsurance intermediary, Blue Atlantic, and an increase in MGA policy fees related to new and renewal
policy volume.
",reinsurance,Financial,0.9999877214431763,9.54384518081497e-08,1.220931426360039e-05,0.084,0.0,0.916,58.79,10.6,11.2,0.8,50,8
UVE_2Q19.pdf,UVE,2019,2Q,"And I'll touch on our reinsurance
program placed at 6/1, and will conclude with some parting thoughts on our risk management initiatives
and associated market dynamics.",reinsurance,Financial,3.8246440681177774e-07,6.171226232254412e-06,0.9999934434890747,0.074,0.074,0.851,45.09,18.09,0.0,0.8846153846153846,26,1
UVE_2Q19.pdf,UVE,2019,2Q,"7On prior year developments, we continue to experience new claims reported in the second quarter on
Hurricane Irma, albeit at a slower clip than prior quarters.",hurricane,Climate,0.006677072495222092,0.99244225025177,0.000880675797816366,0.0,0.0,1.0,28.17,18.09,0.0,0.9615384615384616,26,4
UVE_2Q19.pdf,UVE,2019,2Q,"At this point in the life cycle of Hurricane Irma, the vast majority of any loss development will be
recovered from the Florida Hurricane Catastrophe Fund.",catastrophe,Financial,3.577751704142429e-05,0.0009825287852436304,0.998981773853302,0.0,0.218,0.782,36.63,19.63,0.0,0.8461538461538461,26,2
UVE_2Q19.pdf,UVE,2019,2Q,"As a reinsurance update, we won't go into too much detail here as we've already disseminated the
results of our program in our press release and 8-K on 5/31 with an effective date of June 1.",reinsurance,Financial,1.0698215646698372e-07,1.7070163949028938e-06,0.9999982118606567,0.084,0.0,0.916,51.86,17.73,0.0,0.9444444444444444,36,3
UVE_2Q19.pdf,UVE,2019,2Q,"The cost to us of our reinsurance program is approximately 33.3% of estimated direct
earned premium for the 12-month treaty period.",reinsurance,Financial,4.965597781847464e-07,7.936104339023586e-06,0.9999915361404419,0.0,0.0,1.0,43.9,13.72,0.0,0.9523809523809523,21,2
UVE_2Q19.pdf,UVE,2019,2Q,"In April, new business in Florida rate increases became effective.",rate increases,Financial,0.00039136558189056814,0.0001276248221984133,0.9994810223579407,0.256,0.0,0.744,44.41,16.0,0.0,1.0,10,2
UVE_2Q19.pdf,UVE,2019,2Q,"And in May, renewal business rate
increases became effective, including high single-digit rate increases in certain territories.",rate increases,Financial,0.9725767970085144,2.7025127565138973e-05,0.027396185323596,0.257,0.0,0.743,11.92,18.56,0.0,0.8235294117647058,17,1
UVE_2Q19.pdf,UVE,2019,2Q,"We also have
recently seen double-digit rate increases effective in Minnesota and Pennsylvania in the first quarter and
high single-digit increases effective in the second quarter in Massachusetts and Georgia.",rate increases,Financial,0.9999978542327881,7.0874617286165176e-09,2.0890793166472577e-06,0.181,0.0,0.819,15.65,20.0,0.0,0.7,30,6
UVE_2Q19.pdf,UVE,2019,2Q,"With reinsurance
pricing hardening for this treaty period coupled with AOB reform, which we think is a positive development
but need to build more history on and price competitiveness considerations, we're continually evaluating
what is appropriate as we move forward on rate.",reinsurance,Financial,0.8310635685920715,0.0011903021950274706,0.16774605214595795,0.054,0.0,0.946,11.93,26.32,0.0,0.9285714285714286,42,1
UVE_2Q19.pdf,UVE,2019,2Q,"But our latest rate increases have just become effective,
which will help in the near term.
",rate increases,Financial,0.9993155002593994,9.808975391933927e-07,0.0006835997919552028,0.355,0.0,0.645,72.16,11.4,0.0,1.0,16,0
UVE_2Q19.pdf,UVE,2019,2Q,Few -- just a few -- like I'll start off with a few reinsurance questions.,reinsurance,Financial,0.00020619256247300655,0.005971642676740885,0.9938222169876099,0.172,0.0,0.828,92.12,8.28,0.0,0.8,15,0
UVE_2Q19.pdf,UVE,2019,2Q,"I think in terms of the ongoing creep as we just talked about, the
majority of this portion of the event is going to be borne by the Florida Hurricane Catastrophe Fund.",catastrophe,Financial,1.7091620065912139e-06,0.0014571453211829066,0.9985412359237671,0.0,0.128,0.872,55.92,19.05,0.0,0.84375,32,1
UVE_2Q19.pdf,UVE,2019,2Q,"And I think as I'm
sure, most companies have had some very open and honest discussions with their reinsurance partners.
",reinsurance,Financial,4.554572296910919e-05,0.00035894999746233225,0.999595582485199,0.256,0.0,0.744,68.1,14.0,0.0,1.0,20,0
UVE_2Q19.pdf,UVE,2019,2Q,So they're well aware of what it's going to take to bring Hurricane Irma to final closure.,hurricane,Climate,0.17677022516727448,0.0003719203232321888,0.8228577971458435,0.129,0.0,0.871,71.14,9.15,0.0,0.8823529411764706,17,1
UVE_2Q19.pdf,UVE,2019,2Q,"So I'm not too
concerned with our reinsurance partner's reaction from that standpoint.
",reinsurance,Financial,8.36965955386404e-06,0.01762455701828003,0.9823671579360962,0.0,0.0,1.0,66.74,11.35,0.0,1.0,13,0
UVE_2Q19.pdf,UVE,2019,2Q,"I mentioned in my opening remarks, what's most important, we believe, is what percent of our gross
earned premium are we spending to buy the reinsurance tower that we purchased.",reinsurance,Financial,2.720168595260475e-06,8.015800631255843e-06,0.9999892711639404,0.065,0.096,0.839,49.49,14.67,0.0,0.9333333333333333,30,0
UVE_2Q19.pdf,UVE,2019,2Q,"And then just with the reinsurance rate increases, right, I know you're not going to factor in AOB
reform.",rate increases,Financial,3.484770059003495e-05,0.004290041513741016,0.9956750273704529,0.0,0.0,1.0,69.11,11.81,0.0,1.0,19,1
UVE_2Q19.pdf,UVE,2019,2Q,"I know Florida lets you do like an
accelerated rate filing once you get all the reinsurance paper work completed.",reinsurance,Financial,1.6497426258865744e-05,0.00025427850778214633,0.9997292160987854,0.122,0.0,0.878,51.18,16.0,0.0,0.95,20,1
UVE_2Q19.pdf,UVE,2019,2Q,"And then a question on the balance sheet, reinsurance recover -- the reinsurance
recoverable is $331 million, but the loss reserves are only $288 million.",reinsurance,Financial,4.1497823985992e-06,0.6441531181335449,0.3558427691459656,0.0,0.114,0.886,47.12,14.6,0.0,0.88,25,2
UVE_2Q19.pdf,UVE,2019,2Q,"So the -- and there's also a footnote
for reinsurance, which has the components of that recoverable.",reinsurance,Financial,4.3174304664717056e-07,0.0001936631160788238,0.9998058676719666,0.0,0.0,1.0,55.24,13.9,0.0,0.9411764705882353,17,0
UVE_2Q19.pdf,UVE,2019,2Q,"Organic growth, really conservative reinsurance with a lot of partners we've been doing
business with for 20-plus years.",reinsurance,Financial,0.8297448754310608,0.005359575618058443,0.16489551961421967,0.14,0.0,0.86,44.75,13.87,0.0,0.9444444444444444,18,1
UVE_2Q19.pdf,UVE,2019,2Q,"And then Hurricane Matthew, I'm surprised to hear that it's
developed so much nearly 3 years later.",hurricane,Climate,7.243204163387418e-05,0.029147706925868988,0.9707798957824707,0.112,0.0,0.888,71.14,11.51,0.0,1.0,17,2
UVE_2Q19.pdf,UVE,2019,2Q,"We commuted a very small
portion of our catastrophe program.",catastrophe,Financial,6.00392127125815e-07,4.831916157854721e-05,0.9999511241912842,0.0,0.355,0.645,61.33,12.0,0.0,1.0,10,0
UVE_2Q19.pdf,UVE,2019,2Q,"So what has transpired is the development has slightly crept into the
commuted reinsurance, which we're now retaining net.",reinsurance,Financial,8.195317786885425e-05,0.04302557185292244,0.9568925499916077,0.0,0.0,1.0,52.19,16.02,0.0,0.8947368421052632,19,0
UVE_2Q20.pdf,UVE,2020,2Q,"So, we're off to a solid start to the first half of the year overall, including the successful completion of our
reinsurance renewal on time and on budget.
",reinsurance,Financial,0.9999998807907104,1.7550874531480076e-08,1.1336825878061063e-07,0.178,0.0,0.822,51.52,18.34,0.0,0.8214285714285714,28,1
UVE_2Q20.pdf,UVE,2020,2Q,"In both cases, growth was led by increased volume, rate increases becoming
effective in a series of states, along with slightly improved retention, contributing to premium growth.
",rate increases,Financial,1.0,5.498317801055919e-09,2.013200628425693e-08,0.386,0.0,0.614,35.61,18.21,0.0,1.0,27,0
UVE_2Q20.pdf,UVE,2020,2Q,"The increases were driven primarily by the previously announced increased weather events in the second quarter, a
higher core loss ratio and the impact of higher reinsurance costs on the combined ratio, partially offset by a reduction in
the expense ratio.
",reinsurance,Financial,0.9908599853515625,0.00018864033336285502,0.008951392024755478,0.051,0.056,0.894,21.4,22.25,0.0,0.8048780487804879,41,1
UVE_2Q20.pdf,UVE,2020,2Q,"I will start with some additional color on prior year catastrophe events,
then I'll touch on our experience to date with the second quarter 2020 weather events, and I'll conclude with a few
comments on our reinsurance program effective June 1.
",catastrophe,Financial,1.140577865044179e-06,2.206230601586867e-05,0.9999767541885376,0.07,0.099,0.831,38.32,21.28,0.0,0.8292682926829268,41,3
UVE_2Q20.pdf,UVE,2020,2Q,"On prior year catastrophe events, we continue to make significant progress in resolving the remaining open claims and,
of course, handling the newly reported claims as quickly as possible.",catastrophe,Financial,0.9999969005584717,2.3629525003343588e-07,2.911109731940087e-06,0.197,0.12,0.683,33.58,19.88,0.0,0.896551724137931,29,1
UVE_2Q20.pdf,UVE,2020,2Q,"On Hurricane Irma, despite the fact that 1,800 new claims were reported during the second quarter, we still successfully
reduced the remaining open claim count.",hurricane,Climate,0.9853723645210266,0.014298031106591225,0.00032960117096081376,0.118,0.0,0.882,46.1,16.4,0.0,0.92,25,3
