file_name,Ticker,Year,Quarter,sentence,keyword,category,finbert_positive,finbert_negative,finbert_neutral,vader_positive,vader_negative,vader_neutral,flesch_reading_ease,gunning_fog_index,smog_index,lexical_density,word_count,named_entity_count
TRV_2Q22.pdf,TRV,2022,2Q,"In total, the combined ratio increased 11.5 points compared to the prior year quarter and included a higher underlying
combined ratio, higher catastrophe losses and lower favorable prior year reserve development.",catastrophe,Financial,0.9998459815979004,9.22604067454813e-06,0.0001448069087928161,0.132,0.235,0.633,30.36,12.65,0.0,0.8064516129032258,31,3
TRV_2Q22.pdf,TRV,2022,2Q,"Catastrophe losses were nearly 5 points higher than in the prior year quarter but not out of line with our assumption for
second quarter catastrophes.",catastrophe,Financial,0.9834190607070923,0.0030695011373609304,0.013511454686522484,0.0,0.171,0.829,54.56,14.8,0.0,0.96,25,3
TRV_2Q22.pdf,TRV,2022,2Q,"In Homeowners and Other, the second quarter combined ratio was 118% and included 29 points of catastrophes primarily
from severe wind and hail events across several regions in the U.S.",catastrophe,Financial,6.288990698521957e-05,0.9453039169311523,0.0546332448720932,0.041,0.082,0.878,41.03,17.33,0.0,0.9,30,5
TRV_2Q23.pdf,TRV,2023,2Q,"This quarter, we reported strong underlying results and investment returns as well as net favorable prior
year reserve development, which were essentially offset by an historic level of industry-wide catastrophe
losses.",catastrophe,Financial,1.0,9.728297278854825e-09,7.415593916704211e-09,0.204,0.171,0.625,14.63,22.72,0.0,0.967741935483871,31,2
TRV_2Q23.pdf,TRV,2023,2Q,"There were PCS-designated catastrophe events taking place on 88 of the 91 days of the quarter.
",catastrophe,Financial,4.511800398177002e-06,0.002168541308492422,0.997826874256134,0.0,0.227,0.773,63.7,11.4,0.0,0.875,16,2
TRV_2Q23.pdf,TRV,2023,2Q,"Despite pretax catastrophe losses of $1.5 billion, we generated slightly positive core income for the
quarter.",catastrophe,Financial,0.9999997615814209,2.1031351593592262e-07,5.637765809751727e-08,0.411,0.0,0.589,37.98,10.7,0.0,1.0,16,2
TRV_2Q23.pdf,TRV,2023,2Q,"Parcel level risk assessment at scale was practically
unimaginable until several years ago.",risk assessment,Risk,8.822961490295711e-07,0.00017405358084943146,0.9998251795768738,0.0,0.149,0.851,32.9,14.43,0.0,1.0,13,1
TRV_2Q23.pdf,TRV,2023,2Q,Turning to the topic of reinsurance.,reinsurance,Financial,1.0838518392120022e-05,0.0010364673798903823,0.9989526271820068,0.0,0.0,1.0,56.93,9.07,0.0,1.0,6,0
TRV_2Q23.pdf,TRV,2023,2Q,"Page 20 of the webcast presentation shows a summary of our July 1
reinsurance placements.",reinsurance,Financial,4.640907036446151e-08,1.7625156090161909e-07,0.9999998807907104,0.0,0.0,1.0,47.79,16.67,0.0,0.9333333333333333,15,2
TRV_2Q23.pdf,TRV,2023,2Q,"While we did see some meaningful price increases on our reinsurance renewals,
those increases were broadly in line with the price increases we are obtaining on the direct property
premiums we're writing.",reinsurance,Financial,0.05757405236363411,0.0013461223570629954,0.94107985496521,0.069,0.0,0.931,39.0,20.3,0.0,0.8125,32,0
TRV_2Q23.pdf,TRV,2023,2Q,"First, we renewed our main cat
reinsurance program at terms that were generally consistent with the expiring program.",reinsurance,Financial,4.2120089347008616e-05,0.00023462787794414908,0.9997232556343079,0.0,0.0,1.0,44.75,16.09,0.0,1.0,18,1
TRV_2Q23.pdf,TRV,2023,2Q,"Finally, as part of our ongoing management of tail-risk exposure for the enterprise and in response
to inflation-driven growth and insured values in our Personal Insurance property book, we added a
new hurricane cat excess-of-loss reinsurance program specific to Personal Insurance coastal exposure,
providing 50% coverage for the $1 billion layer above an attachment point of $1.75 billion, again, far out
on the tail.",reinsurance,Financial,0.5296686887741089,5.998332562739961e-05,0.4702712893486023,0.111,0.0,0.889,22.08,21.55,0.0,0.828125,64,5
TRV_2Q23.pdf,TRV,2023,2Q,"In Personal Insurance, the second quarter segment loss
of $538 million and a combined ratio of 122% were significantly impacted by catastrophes.",catastrophe,Financial,3.425037391480146e-07,0.9999939203262329,5.706403953809058e-06,0.0,0.103,0.897,32.22,17.89,0.0,0.9545454545454546,22,3
TRV_2Q23.pdf,TRV,2023,2Q,"While it's
not unusual for us to have a loss in the second quarter, given it's typically the quarter with the highest
weather-related losses, catastrophe losses this quarter for both us and the industry were significantly
elevated compared to historical results.
",catastrophe,Financial,0.010681374929845333,0.9892577528953552,6.086281064199284e-05,0.0,0.252,0.748,12.94,24.2,0.0,0.8048780487804879,41,3
TRV_2Q23.pdf,TRV,2023,2Q,"In homeowners and other, the second quarter combined ratio of 135.1% increased 17.1 points due to
significantly higher catastrophe losses.",catastrophe,Financial,0.9968476891517639,0.0023867699783295393,0.0007655825465917587,0.08,0.271,0.649,47.75,8.68,8.8,1.0,20,3
TRV_2Q23.pdf,TRV,2023,2Q,"Non-cat weather
losses in the quarter were also better than our expectations as more events reached our catastrophe
threshold.
",catastrophe,Financial,1.0,6.344623937337701e-09,1.2255144676842633e-09,0.172,0.266,0.562,52.19,11.81,0.0,0.9473684210526315,19,1
TRV_2Q23.pdf,TRV,2023,2Q,"Behind the aggregate statistics of catastrophe events occurring virtually
every day of the quarter, are tens of thousands of individual customers whose homes and vehicles are
damaged or destroyed and whose lives are disrupted.",catastrophe,Financial,1.1091126907558646e-05,0.9634315371513367,0.03655741363763809,0.0,0.253,0.747,20.05,23.01,0.0,0.7647058823529411,34,2
TRV_2Q23.pdf,TRV,2023,2Q,"Certainly, the catastrophe experience in the quarter
was significantly worse than prior year and worse than our expectations.",catastrophe,Financial,3.50907640722653e-07,0.9999996423721313,3.359913947065252e-08,0.089,0.393,0.519,27.83,16.09,0.0,0.8333333333333334,18,2
TRV_2Q23.pdf,TRV,2023,2Q,"So many times, the catastrophes, the
split between personal and commercial can be -- that really depends on the concentration of where
the catastrophes hit in terms of where commercial businesses are.",catastrophe,Financial,1.2995834595130873e-06,0.0008927789749577641,0.9991058707237244,0.0,0.0,1.0,40.01,18.85,0.0,0.8125,32,0
TRV_2Q23.pdf,TRV,2023,2Q,"Obviously, we have to take catastrophes into
account.",catastrophe,Financial,4.72124338557478e-06,0.04402635246515274,0.9559690356254578,0.0,0.0,1.0,37.98,13.2,0.0,1.0,8,0
TRV_2Q23.pdf,TRV,2023,2Q,"Anything that's unique around the way you're approaching the market there and could you help
dimension at all how much of that re-acceleration of pricing is necessary for the reinsurance costs you
mentioned.",reinsurance,Financial,0.0025486424565315247,0.014123858883976936,0.9833275675773621,0.078,0.0,0.922,46.44,19.26,0.0,0.8787878787878788,33,0
TRV_2Q23.pdf,TRV,2023,2Q,"There's -- reinsurance
costs are higher, inflation is higher.",reinsurance,Financial,0.031056441366672516,0.21986781060695648,0.7490757703781128,0.0,0.0,1.0,46.44,13.2,0.0,1.0,9,0
TRV_2Q23.pdf,TRV,2023,2Q,"How do you think about sort of the magnitude of coming years,
catastrophe load compared to where you've been recently.
",catastrophe,Financial,8.528277248842642e-06,0.00016325472097378224,0.9998281002044678,0.0,0.188,0.812,59.64,14.0,0.0,0.95,20,1
TRV_2Q24.pdf,TRV,2024,2Q,"With the strong and
diversified business and balance sheet, we delivered 13.6% core return on equity over the last 12 months
despite substantial industry-wide catastrophe losses.",catastrophe,Financial,1.0,7.863112827521945e-09,6.8630794380908355e-09,0.206,0.13,0.664,49.82,14.43,0.0,0.9230769230769231,26,2
TRV_2Q24.pdf,TRV,2024,2Q,Turning to reinsurance.,reinsurance,Financial,0.00012479638098739088,0.0024433780927211046,0.9974318146705627,0.0,0.0,1.0,34.59,14.53,0.0,1.0,3,0
TRV_2Q24.pdf,TRV,2024,2Q,"Page 19 of the webcast presentation shows a summary of our July 1 reinsurance
placements.",reinsurance,Financial,5.1018535174307544e-08,1.9099036308034556e-07,0.9999997615814209,0.0,0.0,1.0,47.79,16.67,0.0,0.9333333333333333,15,2
TRV_2Q24.pdf,TRV,2024,2Q,"We also renewed the Personal
Insurance Hurricane cat excess of loss treaty for coastal exposure, which continues to provide 50%
coverage for the $1 billion layer above an attachment point of $2 billion.",hurricane,Climate,0.007914382964372635,6.917673454154283e-05,0.9920164346694946,0.062,0.065,0.873,37.98,21.68,0.0,0.9090909090909091,33,4
TRV_2Q24.pdf,TRV,2024,2Q,Umbrella and Auto led the way with double-digit rate increases.,rate increases,Financial,0.9999998807907104,1.0267860339752133e-08,6.518192918747445e-08,0.0,0.0,1.0,52.87,8.0,0.0,1.0,10,1
TRV_2Q24.pdf,TRV,2024,2Q,"In Personal Insurance and excellent underlying underwriting
results and strong net favorable prior year reserve development drove a significantly improved bottom
line results relative to the prior year quarter despite another period of elevated industry-wide catastrophe
losses.",catastrophe,Financial,1.0,3.6211098564109534e-09,4.997162128539401e-10,0.262,0.141,0.596,-16.85,28.85,0.0,0.8918918918918919,37,3
TRV_2Q24.pdf,TRV,2024,2Q,"While catastrophe lost dollars were similar to the prior year quarter, they had a smaller
combined ratio impact as price increases continue to benefit earned premiums.",catastrophe,Financial,0.9995841383934021,0.00018384707800578326,0.0002319886116310954,0.095,0.211,0.694,36.63,19.63,0.0,0.9615384615384616,26,1
TRV_2Q24.pdf,TRV,2024,2Q,"Catastrophe losses this
quarter, primarily resulting from severe convective storms, again, significantly exceeded long-term
industry averages.",catastrophe,Financial,0.9996116757392883,0.00037945806980133057,8.917966624721885e-06,0.0,0.427,0.573,-12.45,26.4,0.0,1.0,16,1
TRV_2Q24.pdf,TRV,2024,2Q,8Our catastrophe losses in the quarter were consistent with our market share.,catastrophe,Financial,0.0005027804290875793,0.0004105374973732978,0.9990867376327515,0.12,0.388,0.492,59.3,11.47,0.0,1.0,12,2
TRV_2Q24.pdf,TRV,2024,2Q,"Other than that, in any quarter, you're going to have a half a dozen things that move favorably or
unfavorably from mix to base here to the impact of reinsurance and you're seeing the net of those things.
",reinsurance,Financial,0.6662157773971558,0.07433371245861053,0.25945043563842773,0.069,0.0,0.931,58.29,18.36,0.0,0.8421052631578947,38,2
TRV_2Q24.pdf,TRV,2024,2Q,"And the changes to reinsurance, do you expect any impacts to the combined ratio at all or
the underlying combined ratio from any of the movements there?
",reinsurance,Financial,0.00010049977572634816,0.000965489074587822,0.9989339709281921,0.0,0.0,1.0,60.99,13.76,0.0,0.7407407407407407,27,0
TRV_2Q24.pdf,TRV,2024,2Q,"And I'll just
remind you that although cost of reinsurance might have gone up a little bit, we're getting price increases
on the direct side.",reinsurance,Financial,0.15596884489059448,0.021036555990576744,0.822994589805603,0.0,0.0,1.0,63.02,13.2,0.0,1.0,25,0
TRV_2Q24.pdf,TRV,2024,2Q,"Given the changes we've seen in the reinsurance
market the last 1.5 years, should we assume that you're going to be absorbing higher levels of cats going
forward?",reinsurance,Financial,0.001755007542669773,0.12485219538211823,0.8733928203582764,0.0,0.0,1.0,74.19,8.46,0.0,0.8928571428571429,28,1
TRV_2Q24.pdf,TRV,2024,2Q,"So if you look at the reinsurance detail we gave at the January 1 renewals and now
again into July 1 renewals.",reinsurance,Financial,1.8175074956161552e-07,1.3884897498428472e-06,0.9999983310699463,0.0,0.0,1.0,66.07,10.62,0.0,0.8636363636363636,22,2
TRV_2Q24.pdf,TRV,2024,2Q,"So what's coming through
our net result is not really any impact from less use of reinsurance.
",reinsurance,Financial,0.00011138711852254346,0.0005815637996420264,0.9993070363998413,0.0,0.0,1.0,71.14,9.15,0.0,1.0,17,0
TRV_2Q24.pdf,TRV,2024,2Q,It's been quite a decade in terms of catastrophe losses.,catastrophe,Financial,0.00035536912037059665,0.7895951271057129,0.21004951000213623,0.0,0.504,0.496,86.71,8.0,0.0,1.0,10,0
TRV_2Q24.pdf,TRV,2024,2Q,"When we talked about the underlying result this
quarter, I talked about the fact that it was really just fire and non-weather water losses just to put a point
on it and really didn't talk about non-cat weather because in this quarter, it really -- we had both elevated
catastrophes.",catastrophe,Financial,0.0012982164043933153,0.5788396596908569,0.41986212134361267,0.0,0.105,0.895,30.2,22.05,0.0,0.74,50,2
TRV_2Q24.pdf,TRV,2024,2Q,"Not huge, but it did have that
impact this quarter and -- so when we do think about our weather, obviously, we're managing it as one,
but there's a lot of what we would report favorably or unfavorably in small weather that you would see in
the catastrophe line as some of our peers.
",catastrophe,Financial,0.5780494809150696,0.12523218989372253,0.2967183589935303,0.056,0.124,0.82,43.06,24.97,0.0,0.8333333333333334,54,1
TRV_3Q08.pdf,TRV,2008,3Q,"As we
previously reported, the third quarter was meaningfully impacted by $682 million after tax of storm losses
from Hurricanes Ike, Gustav, and Dolly.",hurricane,Climate,5.120596142660361e-06,0.9997710585594177,0.00022380110749509186,0.0,0.105,0.895,30.2,17.93,0.0,1.0,24,4
TRV_3Q08.pdf,TRV,2008,3Q,"As evidence of our underwriting
strength, excluding the impacts of catastrophes and net favorable prior year reserve development, our
combined ratio was 91.8%.
",catastrophe,Financial,1.0,8.120471406414254e-09,1.1309802872006003e-08,0.231,0.0,0.769,31.21,19.63,0.0,0.9130434782608695,23,2
TRV_3Q08.pdf,TRV,2008,3Q,"CAT losses of $682 million net of reinsurance and after tax
which mostly related to Hurricanes Ike, Gustav, and Dolly, added 19.1 points to our GAAP combined
ratios this quarter.",reinsurance,Financial,0.0015815095975995064,0.9833480715751648,0.015070382505655289,0.0,0.085,0.915,64.71,10.0,0.0,0.9,30,6
TRV_3Q08.pdf,TRV,2008,3Q,"On the expense side, after considering the [wind pool] assessments from Hurricane Ike and the timing
impact of the agent compensation, our expense ratio is consistent with previous quarters.",hurricane,Climate,0.0005240489263087511,0.00021188419486861676,0.9992640614509583,0.0,0.0,1.0,33.58,19.88,0.0,0.8620689655172413,29,2
TRV_3Q08.pdf,TRV,2008,3Q,"Additionally, I would note that the surety and professional liability loss ratios were on plan
and none of the deterioration is from these businesses.
",loss ratios,Financial,7.278496923390776e-05,0.9993038177490234,0.0006233621970750391,0.077,0.157,0.766,30.2,17.93,0.0,0.9166666666666666,24,0
TRV_3Q08.pdf,TRV,2008,3Q,"A brief comment on the quarter's storm activity, estimates of CAT losses are detailed in the appendix and
are obviously dominated by losses from Hurricane Ike.",hurricane,Climate,2.5325064143544296e-06,0.0035541076213121414,0.9964434504508972,0.0,0.19,0.81,28.17,19.63,0.0,0.8846153846153846,26,3
TRV_3Q08.pdf,TRV,2008,3Q,"For a little added
context, our Hurricane Ike loss assumes a $3.5 billion event per the Texas Wind Storm Insurance
Association.
",hurricane,Climate,0.00026435102336108685,0.6817787885665894,0.3179568648338318,0.0,0.113,0.887,60.82,9.91,0.0,0.9523809523809523,21,3
TRV_3Q08.pdf,TRV,2008,3Q,"First, about 5.5 points relates to hurricanerelated assessments that flowed through taxes, licenses, and
fees and ultimately the expense ratio.",hurricane,Climate,2.715598930080887e-05,0.03362363949418068,0.9663492441177368,0.0,0.0,1.0,44.41,12.0,0.0,0.95,20,2
TRV_3Q08.pdf,TRV,2008,3Q,"I've heard some chatter among the reinsurers that the
combined impact of AIG's dislocations and the broader financial issues in the market, plus catastrophe
losses, are going to lead to a cycle turn in reinsurance as of 1/1.",catastrophe,Financial,0.0003082223702222109,0.9865933656692505,0.01309832651168108,0.0,0.169,0.831,41.37,20.46,0.0,0.8421052631578947,38,2
TRV_3Q08.pdf,TRV,2008,3Q,"I am not
sure what your views are on the reinsurance side, but on the primary side you can address that.",reinsurance,Financial,2.886443098759628e-06,0.0007655497756786644,0.9992315769195557,0.0,0.072,0.928,84.0,12.21,0.0,0.9047619047619048,21,0
TRV_3Q08.pdf,TRV,2008,3Q,"It would seem, frankly, the cheapest way of prefunding any of these concerns
is to go buy more reinsurance, given you're taking your [retouches] up and reinsurance is still relatively
cheap.",reinsurance,Financial,0.009692790918052197,0.042519763112068176,0.9477874636650085,0.0,0.0,1.0,48.47,17.56,0.0,0.9354838709677419,31,0
TRV_3Q08.pdf,TRV,2008,3Q,"But we see
reinsurance as a longterm cost rather than as a longterm profit opportunity.",reinsurance,Financial,0.9988089799880981,4.0864724724087864e-05,0.001150180702097714,0.407,0.0,0.593,64.71,11.33,0.0,0.8,15,0
TRV_3Q08.pdf,TRV,2008,3Q,"It doesn't say the reinsurers are
dumb so much, but wouldn't it be a good trade to buy reinsurance at a low to midteens cost of capital and
be able to buy back your stock well below book, which is probably a 20%30% return on capital?
",reinsurance,Financial,0.2608891427516937,0.020134316757321358,0.7189764976501465,0.053,0.16,0.787,50.17,21.01,0.0,0.8695652173913043,46,1
TRV_3Q08.pdf,TRV,2008,3Q,"I just struggle with coming to the conclusion
that reinsurance buying is fundamentally capital generating.",reinsurance,Financial,5.8011810324387625e-06,0.7533971667289734,0.246597021818161,0.0,0.15,0.85,13.95,16.67,0.0,1.0,15,0
TRV_3Q08.pdf,TRV,2008,3Q,"I think to your point there has been a periodic tactic when reinsurance gets particularly cheap some
people go out and aggressively buy more.",reinsurance,Financial,0.0001628202444408089,0.6694249510765076,0.33041220903396606,0.0,0.099,0.901,47.12,16.27,0.0,1.0,24,0
TRV_3Q08.pdf,TRV,2008,3Q,"That's a tactical decision on the premise that the losses that
you're avoiding are more than the premium that you are paying for the reinsurance.",reinsurance,Financial,5.644036355079152e-05,0.0007997727952897549,0.9991437196731567,0.0,0.188,0.812,63.02,16.4,0.0,0.76,25,0
TRV_3Q08.pdf,TRV,2008,3Q,"At least as we stand right now, it's not apparent to me that reinsurance is anything now but
actuarially properly priced, not cheap.",reinsurance,Financial,0.19055217504501343,0.035117484629154205,0.7743303775787354,0.0,0.0,1.0,56.59,16.16,0.0,0.9565217391304348,23,0
TRV_3Q08.pdf,TRV,2008,3Q,"Seems like many carriers are able to put some rate increases and right now, with the gaps that people
watch, the underlying cost trends versus premiums has narrowed quite a bit.",rate increases,Financial,0.6325405836105347,0.09172786772251129,0.27573147416114807,0.079,0.0,0.921,56.93,17.56,0.0,0.967741935483871,31,0
TRV_3Q08.pdf,TRV,2008,3Q,"There's actual rates
going up, rate increases that are actually charged.",rate increases,Financial,5.4010338317311835e-06,1.329553469986422e-05,0.9999812841415405,0.0,0.153,0.847,51.85,15.31,0.0,1.0,11,0
TRV_3Q09.pdf,TRV,2009,3Q,"The current quarter also benefited from a significant reduction in cap losses which were down to $103 million after tax as
compared to $682 million after tax in the third quarter of last year when Hurricanes Ike, Gustav, and Dolly made landfall
in the US.",hurricane,Climate,0.9999945163726807,5.030380634707399e-06,4.780017093253264e-07,0.039,0.058,0.903,34.26,21.56,0.0,0.8222222222222222,45,6
TRV_3Q09.pdf,TRV,2009,3Q,"Adjusting for catastrophes and prior year
developments, the year-to-date combined ratio was 94:5, or 60 basis points higher than last year.",catastrophe,Financial,0.9998030066490173,3.0298324418254197e-06,0.00019399843586143106,0.0,0.0,1.0,50.16,14.11,0.0,1.0,21,4
TRV_3Q09.pdf,TRV,2009,3Q,"Operating earnings were up, and the
combined ratio was down, compared to the prior year quarter, due primarily to lower catastrophe losses and improved
large loss experience.",catastrophe,Financial,0.9999997615814209,1.9858302380271198e-07,2.639053420239179e-08,0.084,0.316,0.599,35.61,16.73,0.0,0.8888888888888888,27,1
TRV_3Q09.pdf,TRV,2009,3Q,"Operating earnings are up dramatically from the same quarter last year
due to less major CAT activity, that is there were no Atlantic hurricanes.",hurricane,Climate,0.999997615814209,3.261156678036059e-07,2.070877144433325e-06,0.0,0.087,0.913,38.66,16.27,0.0,1.0,24,3
TRV_3Q09.pdf,TRV,2009,3Q,"It's important to note that although there was no impact from hurricanes in the current year quarter the
aggregate impact of other weather events multiple wind and hail events generated total losses that were normal for the
quarter.",hurricane,Climate,2.800891707011033e-05,0.9998481273651123,0.00012383716239128262,0.074,0.117,0.81,32.91,19.41,0.0,0.868421052631579,38,2
TRV_3Q09.pdf,TRV,2009,3Q,"We started the program in the middle
of '06 we're obviously middle of '09 and that included at least 1 bad year in the catastrophe arena.",catastrophe,Financial,1.9924407752114348e-05,0.0003334094362799078,0.9996466636657715,0.0,0.256,0.744,53.55,15.02,0.0,0.8076923076923077,26,3
TRV_3Q09.pdf,TRV,2009,3Q,"What I'm basically trying to figure
out here is if the re-estimation was frequency driven, was it related to the short, tailed lines mostly written at the beginning
of the year that you assume will mature before next hurricane season or was it something else?
",hurricane,Climate,3.258181823184714e-05,0.0022655220236629248,0.9977019429206848,0.06,0.0,0.94,34.26,22.44,0.0,0.8444444444444444,45,2
TRV_3Q09.pdf,TRV,2009,3Q,"We start the year with an estimate of what
we think our loss ratios are going to be relative to the premiums we're going to write for each one of our lines of business
and as the year progresses, we evaluate information, whether it's frequency statistics, severity statistics, or pricing and
everything else that goes into what comprises a loss ratio and evaluate whether we should be moving off of what we refer
to as the initial loss [fic].",loss ratios,Financial,6.817094799771439e-07,9.25866152101662e-06,0.9999899864196777,0.0,0.084,0.916,-0.26,36.66,0.0,0.6708860759493671,79,1
TRV_3Q10.pdf,TRV,2010,3Q,"Having said that, we've been very clear in the recent
past that the current environment simply doesn't permit achievement of a consistent mid-teens return
right now if one assumes no favorable reserve development and normal catastrophes and weather costs.
",catastrophe,Financial,0.0058810212649405,0.9867722392082214,0.0073467460460960865,0.139,0.051,0.81,31.89,20.73,0.0,0.9487179487179487,39,0
TRV_3Q10.pdf,TRV,2010,3Q,"[catastrophes] and favorable reserve development and including
net investment income were generally in line with our expectation as they have been all year.",catastrophe,Financial,0.00034404025063849986,0.0014391884906217456,0.9982168078422546,0.124,0.0,0.876,31.21,21.37,0.0,0.9565217391304348,23,1
TRV_3Q10.pdf,TRV,2010,3Q,[Excess Casualty Reinsurance Association].,reinsurance,Financial,1.466971752961399e-05,6.612301513087004e-05,0.9999191761016846,0.0,0.531,0.469,-93.33,31.6,0.0,1.0,4,1
TRV_3Q10.pdf,TRV,2010,3Q,"The total awarded to us by the court in this ruling
was $417 million broken down as follows: $251 million owed to us under the terms of the reinsurance
agreement and interest of $166 million.
",reinsurance,Financial,2.0306968508521095e-05,0.002635098062455654,0.9973445534706116,0.207,0.072,0.721,52.87,16.29,0.0,0.8285714285714286,35,3
TRV_3Q10.pdf,TRV,2010,3Q,"Based upon this ruling, we reduced our uncollectible reinsurance reserve by $70 million, thereby reflecting
in our financial statement the full $251 million owed to us under the terms of the reinsurance agreement.
",reinsurance,Financial,0.16959214210510254,0.03903347626328468,0.7913743853569031,0.091,0.0,0.909,37.98,18.05,0.0,0.8787878787878788,33,2
TRV_3Q10.pdf,TRV,2010,3Q,"First, writings in our International businesses are down compared to prior-year quarter as we are
addressing risk and pricing in light of catastrophe and other severe weather losses over the past year.
",catastrophe,Financial,6.030188046679541e-07,0.9999992847442627,1.2475450716920022e-07,0.0,0.296,0.704,39.0,17.8,0.0,0.90625,32,3
TRV_3Q10.pdf,TRV,2010,3Q,"In both Agency, Auto and Property, policies in force continued to grow and core
underwriting margins expanded as earned rate increases outpaced loss cost trends.",rate increases,Financial,1.0,1.6730338003867473e-08,3.259317482573465e-09,0.0,0.087,0.913,46.1,18.0,0.0,0.96,25,2
TRV_3Q10.pdf,TRV,2010,3Q,"While the continental U.S. was not meaningfully impacted by
any of the storms generated during the peak of the hurricane season, the number of near misses this
quarter highlights the importance of underwriting controls and risk management policies in this business.
",hurricane,Climate,0.0002481337869539857,0.9996030926704407,0.00014875430497340858,0.085,0.089,0.826,42.21,16.0,0.0,0.7804878048780488,41,3
TRV_3Q10.pdf,TRV,2010,3Q,"That x development, x catastrophes.",catastrophe,Financial,1.2772324225807097e-05,0.00011549022019607946,0.9998717308044434,0.0,0.0,1.0,32.56,18.0,0.0,0.8,5,0
TRV_3Q11.pdf,TRV,2011,3Q,"I also
couldn't be more pleased with our catastrophe claim management strategy upon which we embarked in
2005.
",catastrophe,Financial,0.009989035315811634,0.48191526532173157,0.5080956816673279,0.0,0.319,0.681,53.21,13.87,0.0,1.0,18,1
TRV_3Q11.pdf,TRV,2011,3Q,Losses related to Hurricane Irene were $253 million after-tax.,hurricane,Climate,7.245744200190529e-05,0.7273743152618408,0.2725532054901123,0.0,0.252,0.748,36.96,12.49,0.0,1.0,9,2
TRV_3Q11.pdf,TRV,2011,3Q,"You will recall that
last year, the asbestos reserve increase was net of a reduction in the uncollectible reinsurance reserve of
$70 million or $45 million after tax, that resulted from a favorable ruling related to a reinsurance dispute.",reinsurance,Financial,0.9839651584625244,0.00038224359741434455,0.01565253920853138,0.131,0.066,0.803,31.89,21.75,0.0,0.7948717948717948,39,3
