file_name,Ticker,Year,Quarter,sentence,keyword,category,finbert_positive,finbert_negative,finbert_neutral,vader_positive,vader_negative,vader_neutral,flesch_reading_ease,gunning_fog_index,smog_index,lexical_density,word_count,named_entity_count
TRV_4Q13.pdf,TRV,2013,4Q,"Excluding these items, the pure margin expansion, that is the impact of rate increases in excess
of loss trend, was 2.5 points in the quarter and 2.7 points for the full year.
",rate increases,Financial,0.9999998807907104,1.4688771088344765e-08,1.3800199383240397e-07,0.0,0.069,0.931,85.99,8.03,8.8,0.8125,32,4
TRV_4Q13.pdf,TRV,2013,4Q,"The 8% included pure rate increases of about 6%, down about 1 point from the last few
quarters.",rate increases,Financial,0.008676175028085709,0.7044581770896912,0.2868656516075134,0.0,0.0,1.0,78.59,11.64,0.0,0.9444444444444444,18,4
TRV_4Q13.pdf,TRV,2013,4Q,The rate increases continue to be broad-based and were led by Commercial Auto.,rate increases,Financial,0.23413923382759094,3.765982546610758e-05,0.7658231258392334,0.0,0.0,1.0,58.28,14.43,0.0,1.0,13,1
TRV_4Q13.pdf,TRV,2013,4Q,"Specifically, retention in our better performing business was very strong, with reasonable rate increases.",rate increases,Financial,1.0,4.0657512911934646e-09,1.7979484567831605e-09,0.351,0.0,0.649,31.89,19.89,0.0,1.0,14,0
TRV_4Q13.pdf,TRV,2013,4Q,"So you can see clearly
from this slide that over the last 2 years, we've been able to consistently get meaningful rate increases on
the portfolio for poorer performing accounts.
",rate increases,Financial,0.9999984502792358,1.5631710539310006e-06,2.6033736943986696e-08,0.149,0.075,0.776,49.49,18.67,0.0,0.9666666666666667,30,1
TRV_4Q13.pdf,TRV,2013,4Q,"The underlying
GAAP combined ratio of 94.7 deteriorated 3.2 points over the prior-year quarter due to a higher underlying
loss ratio, reflecting a higher level of large losses and non-cat weather-related losses for international, as
well as the Dominion acquisition, partially offset by earned rate increases that exceeded loss cost trends.
",rate increases,Financial,0.9942440390586853,0.004318874794989824,0.0014370523858815432,0.037,0.178,0.784,28.84,14.64,14.6,0.8431372549019608,51,4
TRV_4Q13.pdf,TRV,2013,4Q,"Management liability premium increased as a
result of our decision to discontinue the excess of loss reinsurance treaty for this business.
",reinsurance,Financial,0.3382475674152374,0.03173106908798218,0.6300213932991028,0.091,0.177,0.733,24.78,19.83,0.0,0.9523809523809523,21,0
TRV_4Q13.pdf,TRV,2013,4Q,"A very strong result driven in part by
lower catastrophe losses, but also reflective of improvement in our underlying Auto and Homeowner
results.
",catastrophe,Financial,1.0,3.266761083864367e-09,1.5142294085279673e-09,0.214,0.209,0.577,31.21,17.9,0.0,0.9565217391304348,23,1
TRV_4Q13.pdf,TRV,2013,4Q,"And as I said, for the poorer performing accounts, obviously, we've got some that
are still well into the 20s, but think solid double-digit rate increases.
",rate increases,Financial,0.999871015548706,0.00012633309233933687,2.623290583869675e-06,0.127,0.064,0.809,53.55,15.02,0.0,0.9615384615384616,26,1
TRV_4Q13.pdf,TRV,2013,4Q,"In the
better performing businesses, as I've said in the comments, we're still getting rate increases on a written
basis that exceed our loss cost growth.",rate increases,Financial,1.0,1.8945955915228296e-08,7.406349311622762e-09,0.185,0.077,0.738,53.55,15.02,0.0,0.9615384615384616,26,0
TRV_4Q13.pdf,TRV,2013,4Q,"For the last 2-plus years, it's gotten the strongest rate increases across our
portfolio.",rate increases,Financial,1.0,5.546728854000094e-09,1.3888521444016533e-08,0.182,0.0,0.818,74.19,11.31,0.0,0.9285714285714286,14,1
TRV_4Q13.pdf,TRV,2013,4Q,"For example, a change in the reinsurance
program in our management liability business, and as earned rate continues -- as written rate from that
prior year and this year continues to earn in at a higher level than loss cost, so that margin improvement,
together with the reinsurance program, on a segment basis we're talking about, should be about -- on an
underlying basis x cats and PYD.
",reinsurance,Financial,0.9999982118606567,6.887672299171754e-08,1.6322238707289216e-06,0.048,0.06,0.892,12.95,30.64,0.0,0.7647058823529411,68,3
TRV_4Q13.pdf,TRV,2013,4Q,"Just curious,
given the rate increases, I would have expected a 3-point improvement year-over-year.
",rate increases,Financial,0.9434232115745544,0.0005519791739061475,0.05602481588721275,0.346,0.0,0.654,57.27,17.03,0.0,1.0,14,1
TRV_4Q13.pdf,TRV,2013,4Q,"One of the other things that's always going to impact the year-over-year, quarter-over-quarter look
at the loss ratios, in particular would be mix changes in the business, which -- what products are of higher
percentage 1 year versus the next, how much loss sensitive business there is relative to guaranteed cost,
",loss ratios,Financial,0.00024860247503966093,0.004827741999179125,0.9949236512184143,0.0,0.087,0.913,29.19,24.0,0.0,0.8431372549019608,51,3
TRV_4Q14.pdf,TRV,2014,4Q,"Within underwriting, we continue to earn rate increases in excess of loss
cost trends, which was the driver of 100-basis-point improvement in our underlying combined ratio this
quarter versus the prior year quarter, while experiencing only a modest level of cap losses and very strong
net favorable prior year reserve development.
",rate increases,Financial,1.0,1.5800466712789785e-08,2.1416342033120372e-09,0.166,0.083,0.751,11.25,26.67,0.0,0.8823529411764706,51,4
TRV_4Q14.pdf,TRV,2014,4Q,"We've taken advantage of the recent evolution in aggregate cap reinsurance products to restructure our
cat cover, further focusing on severe events than on a single or cumulative basis could impact capital.
",reinsurance,Financial,0.644752025604248,0.018848946318030357,0.33639898896217346,0.06,0.077,0.863,22.08,21.55,0.0,0.96875,32,0
TRV_4Q14.pdf,TRV,2014,4Q,"Our Northeast gen cat treaty, our cat bonds earthquake and international covers remain unchanged.",earthquake,Climate,3.6667788094746356e-07,2.705274937397917e-06,0.9999969005584717,0.0,0.0,1.0,57.27,8.46,0.0,0.9285714285714286,14,0
TRV_4Q14.pdf,TRV,2014,4Q,"In that vein, the extreme weather volatility has added risk to the home exposure, making our industry-
leading capabilities in the Homeowners line an even more significant competitive advantage and critical for
the customer segment we target.",extreme weather,Climate,0.9999973773956299,1.987086307053687e-06,5.400056579674128e-07,0.148,0.103,0.749,17.0,24.53,0.0,0.918918918918919,37,1
TRV_4Q14.pdf,TRV,2014,4Q,"While earned pricing in excess of loss trend contributed favorably to full year 2014 results,
it was also a negative impact of about 1.5 for non-catastrophe weather and large losses relative to the
prior year.",catastrophe,Financial,0.9999991655349731,6.830667302892834e-07,1.0709822362287014e-07,0.063,0.211,0.726,62.17,12.71,0.0,0.9428571428571428,35,3
TRV_4Q14.pdf,TRV,2014,4Q,"I didn't quite
follow how that fits in the conversation, but I think you're saying the good part of the book becomes more
rate adequate, the places where you're trying to seek rate increases may have, kind of, a bigger impact on
a quarterly basis than what we see for rate changes.",rate increases,Financial,0.002149458508938551,0.007339417468756437,0.9905111193656921,0.126,0.0,0.874,44.08,23.88,0.0,0.8461538461538461,52,1
TRV_4Q14.pdf,TRV,2014,4Q,"As far as your specific question on
the Surety reinsurance, there is no effect on development.",reinsurance,Financial,6.773847758267948e-07,0.00012015369429718703,0.9998791217803955,0.11,0.121,0.769,55.24,13.9,0.0,0.9375,16,1
TRV_4Q14.pdf,TRV,2014,4Q,"Is there anything that you think could happen in the
reinsurance market as far as evolution or innovation that would allow you or how you to consider pursuing
more growth in catastrophe exposed areas, utilizing reinsurance or is that something at this point it's still
not something that you foresee?
",catastrophe,Financial,0.00029136359808035195,0.0034617925994098186,0.996246874332428,0.127,0.102,0.771,29.19,25.6,0.0,0.76,50,0
TRV_4Q14.pdf,TRV,2014,4Q,"The specific question you ask is, are you prepared to build primary exposure and rely on
a reinsurance profile that may or may not be permanent to produce an effective loss profile?",reinsurance,Financial,4.988542968931142e-06,0.0021492280066013336,0.9978457689285278,0.142,0.065,0.793,39.0,20.3,0.0,0.90625,32,0
TRV_4Q14.pdf,TRV,2014,4Q,Reinsurance obviously can be non-renewed instantly.,reinsurance,Financial,2.5212714263034286e-06,0.00016937786131165922,0.9998281002044678,0.0,0.0,1.0,-10.76,22.4,0.0,1.0,6,0
TRV_4Q14.pdf,TRV,2014,4Q,"And when that happens, even if you did
pursue a primary nonrenewal strategy, you're at 12 months where you're out of sync, where the primary
exposure sits and the reinsurance is simply not there anymore.",reinsurance,Financial,4.454253144103859e-07,3.4908796806121245e-05,0.9999645948410034,0.0,0.0,1.0,44.41,19.71,0.0,0.8857142857142857,35,1
TRV_4Q14.pdf,TRV,2014,4Q,"Now if reinsurance pricing were to drift low enough and, in
my judgment, it is not there yet, you might sit there and contemplate doing that.",reinsurance,Financial,6.155185474199243e-06,0.540435791015625,0.45955806970596313,0.0,0.077,0.923,70.47,13.48,0.0,0.9615384615384616,26,0
TRV_4Q14.pdf,TRV,2014,4Q,"We really have no interest in the reinsurance business in the broader
sense.",reinsurance,Financial,1.5493819773837458e-06,0.0005307699320837855,0.999467670917511,0.195,0.148,0.657,58.28,11.35,0.0,0.8461538461538461,13,0
TRV_4Q14.pdf,TRV,2014,4Q,"So the last couple of years, you've generated statutory underwriting losses of about $100
million in the businesses growing top line a bit, you're getting a little bit of scale economics probably.",underwriting losses,Financial,1.5907172610241105e-06,0.9999737739562988,2.469310857122764e-05,0.105,0.081,0.813,30.54,20.3,0.0,0.875,32,2
TRV_4Q15.pdf,TRV,2015,4Q,The second question is on the pace of future rate increases.,rate increases,Financial,1.6885089280549437e-05,0.11801551282405853,0.8819676041603088,0.0,0.0,1.0,68.77,8.04,0.0,1.0,11,1
TRV_4Q15.pdf,TRV,2015,4Q,"The 1% drag was on the Middle Market exposure change, the 3% was on total domestic BI.",market exposure,Financial,5.88152943237219e-06,0.1501763015985489,0.8498178124427795,0.0,0.106,0.894,71.14,11.51,0.0,0.8235294117647058,17,3
TRV_4Q15.pdf,TRV,2015,4Q,The 1% exposure drag is Middle Market exposure.,market exposure,Financial,2.0457391656236723e-06,0.008441119454801083,0.9915568828582764,0.0,0.213,0.787,46.44,8.2,0.0,1.0,8,2
TRV_4Q16.pdf,TRV,2016,4Q,"These results were driven by the
continued solid underwriting performance as evidenced by our consolidated combined ratio of 90%,
which included the favorable impact of prior year reserve development, which I'll discuss shortly, as well
as the unfavorable impacts of cat losses of $137 million pretax that related to Hurricane Matthew and
the fires in Tennessee, and higher-than-expected auto BI losses in personal insurance.",hurricane,Climate,1.0,7.703176763129704e-09,3.617844468450926e-09,0.096,0.076,0.829,-10.41,34.98,0.0,0.796875,64,6
TRV_4Q16.pdf,TRV,2016,4Q,"The quarter also
benefited from the settlement of a reinsurance dispute and higher after tax net investment income, which
after increasing sequentially quarter-by-quarter this year, increased 12% this quarter over the prior year
quarter, all due to higher nonfixed income returns.",reinsurance,Financial,1.0,2.9507605248113578e-09,6.77909950397293e-09,0.049,0.063,0.888,12.94,21.28,0.0,0.8780487804878049,41,5
TRV_4Q16.pdf,TRV,2016,4Q,There are 2 topics I'd like to cover relating to reinsurance.,reinsurance,Financial,2.5726049557306396e-07,4.4470096327131614e-05,0.9999552965164185,0.217,0.0,0.783,68.77,11.67,0.0,0.9090909090909091,11,1
TRV_4Q16.pdf,TRV,2016,4Q,"First, we are very pleased this quarter to have
settled with one of our reinsurers in the U.S. FMG versus Armory, et al., case, our reinsurance dispute
has been pending for many years.",reinsurance,Financial,0.9999734163284302,7.558714543165479e-08,2.6487054128665477e-05,0.087,0.073,0.84,85.69,6.82,7.8,0.9696969696969697,33,6
TRV_4Q16.pdf,TRV,2016,4Q,"Operating cash flows were very strong this quarter, $1.14 billion, including the proceeds from the
settlement of the reinsurance dispute I just mentioned.",reinsurance,Financial,1.0,2.0885946305782e-09,2.366932783104403e-08,0.137,0.103,0.761,59.8,9.82,0.0,0.9130434782608695,23,2
TRV_4Q16.pdf,TRV,2016,4Q,"Retention for our domestic businesses remained at historically high levels, and we successfully
achieved positive rate change with renewal premium increases of over 2%.
",premium increases,Financial,1.0,7.636367094221441e-09,1.8093181397560443e-09,0.236,0.0,0.764,13.28,24.6,0.0,1.0,24,1
TRV_4Q16.pdf,TRV,2016,4Q,"The underlying
loss ratio was 1.4 points lower than the prior year due to lower large losses and non-catastrophe weather-
related losses, partially offset by a modest amount of margin compression.
",catastrophe,Financial,0.0015008202753961086,0.9984775185585022,2.1719055439461954e-05,0.0,0.326,0.674,47.28,12.65,0.0,0.967741935483871,31,2
TRV_4Q16.pdf,TRV,2016,4Q,"And in November and December of 2016, rate increases were implemented in 16 states, which cover
about 60% of our quote volume.",rate increases,Financial,7.578855729661882e-05,1.4935326362319756e-05,0.9999092817306519,0.0,0.0,1.0,57.61,12.44,0.0,0.9090909090909091,22,3
TRV_4Q16.pdf,TRV,2016,4Q,"If you could just give us some indication of how we should be thinking about
sort of the starting point for '17 and given the adjustments you've made through the year, when should we
start to see the rate increases flow through?",rate increases,Financial,0.0003675861225929111,0.0004372061521280557,0.9991951584815979,0.0,0.0,1.0,54.23,19.66,0.0,0.8571428571428571,42,2
TRV_4Q16.pdf,TRV,2016,4Q,"So I think you will see
the rate increases start to flow through in the first quarter.",rate increases,Financial,0.006873934995383024,0.0006440053693950176,0.9924820065498352,0.0,0.0,1.0,88.06,9.15,0.0,0.9411764705882353,17,1
TRV_4Q16.pdf,TRV,2016,4Q,"Importantly, you don't see a lot of the fourth quarter rate filing activity
in the production statistics just because of the timing of those rate increases.",rate increases,Financial,1.0223120625596493e-06,0.0008741284837014973,0.9991248250007629,0.087,0.0,0.913,45.09,18.09,0.0,0.8076923076923077,26,1
TRV_4Q16.pdf,TRV,2016,4Q,"And I'm wondering if you could share your
thoughts on how that may affect your purchase of reinsurance from non-U.S. companies.
",reinsurance,Financial,2.817946187860798e-05,0.001797290751710534,0.9981745481491089,0.099,0.0,0.901,67.08,14.11,0.0,0.9523809523809523,21,1
TRV_4Q16.pdf,TRV,2016,4Q,"I think broadly speaking, as it relates to us and reinsurance, I think our answer would
be, we're by and large, a gross line underwriter.",reinsurance,Financial,1.2541134992716252e-06,3.3758144581952365e-06,0.9999953508377075,0.0,0.129,0.871,63.02,13.2,0.0,0.88,25,0
TRV_4Q16.pdf,TRV,2016,4Q,"We like our underwriting, we like to keep it, and we buy
reinsurance in pretty modest amounts.",reinsurance,Financial,0.003900461597368121,4.616175647242926e-05,0.9960533380508423,0.369,0.0,0.631,71.14,11.51,0.0,0.8823529411764706,17,0
TRV_4Q16.pdf,TRV,2016,4Q,"And so if there were a tax adjustments that change the cost of
reinsurance, obviously, we could look for alternative providers of reinsurance.",reinsurance,Financial,1.1692600310198031e-05,0.0002003157278522849,0.9997879862785339,0.0,0.0,1.0,56.59,16.16,0.0,0.9565217391304348,23,0
TRV_4Q16.pdf,TRV,2016,4Q,"But I think the
broader point for us is reinsurance isn't just that big of a deal for us.
",reinsurance,Financial,1.6427475202362984e-05,0.0024234445299953222,0.9975601434707642,0.0,0.0,1.0,86.03,9.71,0.0,0.9473684210526315,19,0
TRV_4Q17.pdf,TRV,2017,4Q,"The fact that we were able to generate that level of profit and profitability given the extraordinary
catastrophe losses for the industry this quarter and year, on top of a decade of historically low interest
rates and several years of a relatively soft pricing environment, speaks to the earnings power of the
franchise.",catastrophe,Financial,1.0,5.068798714091827e-08,1.9269130735466433e-09,0.156,0.146,0.698,9.22,27.99,0.0,0.7735849056603774,53,3
TRV_4Q17.pdf,TRV,2017,4Q,"For the year, catastrophe losses were manageable, and we generated an after-tax underlying underwriting
gain in excess of $1.2 billion and after-tax net investment income of nearly $1.9 billion.",catastrophe,Financial,0.9992054104804993,1.703433554212097e-05,0.0007776117417961359,0.093,0.195,0.712,31.38,14.08,0.0,0.896551724137931,29,3
TRV_4Q17.pdf,TRV,2017,4Q,"It's an acceleration of a trend and improved pricing we've achieved over the past 6 quarters as the market
started reacting to 2 things: first, the hurricanes and wildfires in the back half of the year; and second and
more significant in my view, declining margins generally as interest rates remain at historically low levels
and loss trend has outpaced rate and exposure for a few years now.
",hurricane,Climate,0.9999998807907104,8.103068438458649e-08,9.723529537097875e-09,0.114,0.061,0.824,10.92,32.49,0.0,0.7941176470588235,68,5
TRV_4Q17.pdf,TRV,2017,4Q,"Other factors,
for example, include the adequacy of expiring prices, loss trend, expenses, the cost of reinsurance, the
impact of claims initiatives and so on.",reinsurance,Financial,0.00010155852214666083,0.004414910450577736,0.9954835176467896,0.0,0.087,0.913,37.64,19.6,0.0,0.84,25,0
TRV_4Q17.pdf,TRV,2017,4Q,"Rather, these reductions were
reflective of a continued high level of cat activity and the inclusion of an $82 million after-tax benefit in the
prior year quarter from the settlement of a reinsurance dispute.
",reinsurance,Financial,0.31947827339172363,0.0638737604022026,0.6166480183601379,0.084,0.076,0.84,28.51,21.84,0.0,0.8235294117647058,34,2
TRV_4Q17.pdf,TRV,2017,4Q,"Income was
down from the prior year due primarily to the settlement of a reinsurance dispute in the fourth quarter
of 2016.",reinsurance,Financial,1.0098078746523242e-05,0.9994088411331177,0.000581054191570729,0.0,0.119,0.881,57.61,12.44,0.0,0.8636363636363636,22,2
TRV_4Q17.pdf,TRV,2017,4Q,"In addition, pricing in the quarter improved across the
continuum of Middle Market book, most significantly in our poor-performing accounts where we achieved
rate increases well in excess of loss trend.",rate increases,Financial,0.9999974966049194,2.4570751975261373e-06,2.5980337881037485e-08,0.146,0.065,0.789,31.55,18.85,0.0,0.8709677419354839,31,2
TRV_4Q17.pdf,TRV,2017,4Q,"Finally, in addition to what we're seeing in the numbers, we're
also encouraged that there has been some tightening of terms and conditions for catastrophe-exposed
risks.
",catastrophe,Financial,0.9999998807907104,1.6661774182580302e-08,1.0637639036303881e-07,0.087,0.073,0.839,36.63,18.09,0.0,0.9230769230769231,26,0
TRV_4Q17.pdf,TRV,2017,4Q,"Since our 10-K won't be filed for a few weeks, I would note that we
expect underlying underwriting margins in 2018 will be higher than in 2017 and the underlying combined
ratio will be slightly lower than in 2017, assuming lower and more normalized levels of non-catastrophe
weather-related losses and other loss activity.",catastrophe,Financial,0.710296630859375,0.28947606682777405,0.00022733239165972918,0.0,0.158,0.842,17.68,26.48,0.0,0.8113207547169812,53,5
TRV_4Q17.pdf,TRV,2017,4Q,"Catastrophe losses in the
quarter were approximately $200 million after tax, above both prior year and our normal expectations,
resulting in a $50 million loss for the quarter and a combined ratio of 108.7%.",catastrophe,Financial,0.04918540269136429,0.9487043619155884,0.0021102100145071745,0.0,0.245,0.755,36.97,18.31,0.0,0.8235294117647058,34,6
TRV_4Q17.pdf,TRV,2017,4Q,"For domestic Agency Auto, combined ratio for the quarter was 103%, including a 1.1-point benefit
from catastrophe losses as we reduced our auto estimate related to Hurricane Harvey.",catastrophe,Financial,1.3007271263631992e-05,0.9999045133590698,8.243451156886294e-05,0.088,0.208,0.704,31.89,15.6,0.0,1.0,28,5
TRV_4Q17.pdf,TRV,2017,4Q,"The fourth quarter combined ratio of 115.3% included over 45
points from cat losses, driven by the wildfires in California.",wildfire,Climate,2.624222133817966e-06,0.9999819993972778,1.5395959053421393e-05,0.0,0.124,0.876,61.33,8.0,0.0,1.0,20,4
TRV_4Q17.pdf,TRV,2017,4Q,"Overall, in Personal Insurance, while the headlines were all about the significant catastrophe losses, we
feel great about having achieved the goals we had established entering 2017.",catastrophe,Financial,1.0,1.524890258508549e-08,4.562084043868708e-09,0.164,0.197,0.639,44.07,19.69,0.0,0.8518518518518519,27,2
TRV_4Q17.pdf,TRV,2017,4Q,"Given that the hurricanes were in the third quarter, we're very pleased with our agility 1 quarter in, in
terms of what we've been trying to do on the national property side.",hurricane,Climate,1.0,1.929432169589518e-09,2.3819323402562986e-08,0.096,0.0,0.904,64.38,16.55,0.0,0.90625,32,2
TRV_4Q18.pdf,TRV,2018,4Q,"Of course, our results were also
impacted by a high level of catastrophe losses.",catastrophe,Financial,1.0115022632817272e-06,0.9999936819076538,5.339209565136116e-06,0.0,0.392,0.608,57.27,11.31,0.0,1.0,14,0
TRV_4Q18.pdf,TRV,2018,4Q,"To wrap it up, despite another year of elevated catastrophe losses, we achieved an 11% return on
equity.",catastrophe,Financial,0.9999701976776123,1.0653740901034325e-05,1.9191498722648248e-05,0.0,0.307,0.693,44.75,13.87,0.0,1.0,18,2
TRV_4Q18.pdf,TRV,2018,4Q,"The decrease in both measures from last year's
fourth quarter resulted primarily from a higher level of catastrophe losses and a lower level of favorable
prior year reserve development.",catastrophe,Financial,0.0007049516425468028,0.9989058971405029,0.0003891797096002847,0.088,0.263,0.65,25.12,18.5,0.0,0.8620689655172413,29,2
TRV_4Q18.pdf,TRV,2018,4Q,"Last year's fourth quarter cat losses of $499 million included favorable development of
$157 million primarily related to the hurricanes from the third quarter of 2017.",hurricane,Climate,0.0018337640212848783,0.8408805727958679,0.1572856903076172,0.104,0.091,0.805,36.63,19.63,0.0,0.8076923076923077,26,4
TRV_4Q18.pdf,TRV,2018,4Q,"As you all know, the
industry has experienced an elevated level of catastrophe losses in recent years.",catastrophe,Financial,4.36582831753185e-06,0.9999397993087769,5.585804319707677e-05,0.0,0.321,0.679,37.3,16.21,0.0,1.0,17,1
TRV_4Q18.pdf,TRV,2018,4Q,"In further recognition of recent
weather activity and ongoing uncertainty, for 2019, we have also added a new catastrophe aggregate XOL
treaty as described on Slide 19.",catastrophe,Financial,9.623619007470552e-06,0.0241679847240448,0.9758223295211792,0.0,0.221,0.779,35.61,19.69,0.0,1.0,27,3
TRV_4Q18.pdf,TRV,2018,4Q,"Hurricane and earthquake events have
a $250 million per occurrence cap.",hurricane,Climate,9.334961760032456e-06,0.0018721622182056308,0.9981185793876648,0.0,0.0,1.0,68.77,11.67,0.0,1.0,11,1
TRV_4Q18.pdf,TRV,2018,4Q,"Since the majority of any loss recoveries from this treaty will likely benefit our net catastrophe losses,
which are excluded from underlying results, we expect about 0.5 point impact on the full year underlying
combined ratio but a minimal impact on the full year total combined ratio.",catastrophe,Financial,0.03256143257021904,0.0006031602970324457,0.9668353796005249,0.039,0.155,0.806,39.16,15.36,0.0,0.8085106382978723,47,3
TRV_4Q18.pdf,TRV,2018,4Q,"The lower combined ratio was driven by improved auto results, lower catastrophes
and higher net favorable prior year reserve development.
",catastrophe,Financial,1.0,6.803335228511287e-09,3.9776047344730614e-08,0.233,0.165,0.602,25.8,14.0,0.0,0.95,20,1
TRV_4Q18.pdf,TRV,2018,4Q,"The quarter also benefited from higher net
favorable prior year reserve development, partially offset by higher catastrophes.",catastrophe,Financial,0.9999995231628418,6.28322993634356e-08,4.1521911953168456e-07,0.162,0.0,0.838,11.92,18.56,0.0,0.9411764705882353,17,2
TRV_4Q18.pdf,TRV,2018,4Q,"Recall that the prior year
quarter included a benefit from the reestimation of catastrophes, including Hurricane Harvey.
",catastrophe,Financial,0.8142746686935425,0.023539554327726364,0.16218575835227966,0.167,0.0,0.833,20.38,20.92,0.0,0.9411764705882353,17,2
TRV_4Q18.pdf,TRV,2018,4Q,"The full year combined ratio of 105.6% reflects a second consecutive year of very high catastrophe losses,
which again accounted for approximately 24 points of the combined ratio.",catastrophe,Financial,0.9955536723136902,0.004418995697051287,2.7349931770004332e-05,0.0,0.234,0.766,57.27,11.31,0.0,0.8571428571428571,28,4
TRV_4Q18.pdf,TRV,2018,4Q,"The full year 2018 underlying
combined ratio was 81.6%, 4.5 points higher than 2017, driven by higher levels of non-catastrophe
weather and nonweather loss activity.",catastrophe,Financial,0.9999741315841675,1.213251721310371e-07,2.5749486667336896e-05,0.0,0.087,0.913,50.33,11.4,0.0,0.96,25,4
TRV_4Q18.pdf,TRV,2018,4Q,"Consistent with comments we made earlier this year, given this
recent catastrophe and a non-catastrophe loss experience, and our assumption that some of this elevated
loss pressure will persist, we continue to implement granular pricing and underwriting actions to manage
our exposure and improve results.
",catastrophe,Financial,0.9999983310699463,1.2698518503384548e-06,3.041280081106379e-07,0.055,0.211,0.734,8.88,27.78,0.0,0.8,45,1
TRV_4Q18.pdf,TRV,2018,4Q,"So as we look at the California wildfires, clearly, 2 significant years in a row of losses.",wildfire,Climate,3.759068204089999e-05,0.9994953870773315,0.000467006117105484,0.234,0.141,0.625,62.68,11.51,0.0,1.0,17,2
