file_name,Ticker,Year,Quarter,sentence,keyword,category,finbert_positive,finbert_negative,finbert_neutral,vader_positive,vader_negative,vader_neutral,flesch_reading_ease,gunning_fog_index,smog_index,lexical_density,word_count,named_entity_count
RLI_1Q08.pdf,RLI,2008,1Q,"And on
the other side the large items of reinsurance happens to be our catastrophe covers and we’ve seen a
fairly significant reduction in our CAT covers",catastrophe,Financial,0.004297750536352396,0.8758836984634399,0.11981857568025589,0.06,0.146,0.795,52.53,16.73,0.0,0.8888888888888888,27,1
RLI_1Q08.pdf,RLI,2008,1Q,"You haven’t mentioned it, my questions on the topic of reinsurance
and you haven’t mentioned it",reinsurance,Financial,2.8222827950230567e-06,0.005908491089940071,0.9940886497497559,0.0,0.0,1.0,72.16,8.9,0.0,0.875,16,0
RLI_1Q08.pdf,RLI,2008,1Q,"Doesn’t sound like in the area of casualty writing that you’re looking to buy
more reinsurance and I was wondering given the sort of indicated profitability that would be an extension
of the accident year loss ratio for that line why you’re not considering that.",reinsurance,Financial,0.0008007677388377488,0.016108764335513115,0.9830905199050903,0.083,0.169,0.748,25.8,24.22,0.0,0.8444444444444444,45,0
RLI_1Q08.pdf,RLI,2008,1Q,"We, I suppose on the margin when you look at how much reinsurance we
buy, we may be influenced one way or another by the price.",reinsurance,Financial,9.603761554899393e-07,0.0003146295784972608,0.9996844530105591,0.0,0.0,1.0,70.47,13.48,0.0,0.9230769230769231,26,1
RLI_1Q08.pdf,RLI,2008,1Q,"But in our reinsurance buying decisions the
first and foremost critical issues is whether or not those reinsure, we believe the reinsurers will be there to
pay the claim in the future.",reinsurance,Financial,0.0008149860659614205,0.09991860389709473,0.8992664217948914,0.0,0.132,0.868,55.92,17.8,0.0,0.875,32,1
RLI_1Q08.pdf,RLI,2008,1Q,"So the most important thing for us in reinsurance buying decisions is security.
",reinsurance,Financial,0.0021553279366344213,0.0020690495148301125,0.9957756400108337,0.302,0.0,0.698,41.36,14.43,0.0,1.0,13,0
RLI_1Q08.pdf,RLI,2008,1Q,The second thing is how much reinsurance do we need to buy?,reinsurance,Financial,0.00017055190983228385,0.011827641166746616,0.9880018830299377,0.0,0.0,1.0,84.68,8.13,0.0,1.0,12,1
RLI_1Q08.pdf,RLI,2008,1Q,"So we’re not going to buy reinsurance if
we don’t need to buy it.",reinsurance,Financial,4.180696123512462e-06,0.0004526721895672381,0.9995431900024414,0.0,0.0,1.0,91.11,8.46,0.0,0.8571428571428571,14,0
RLI_1Q08.pdf,RLI,2008,1Q,"And then lastly and I think its way down on the list is the, what the price of the
reinsurance is.",reinsurance,Financial,8.743901958041533e-07,0.0013969013234600425,0.9986023306846619,0.0,0.0,1.0,92.46,10.3,0.0,0.9047619047619048,21,0
RLI_1Q08.pdf,RLI,2008,1Q,"So we’re not a market that is out there, you’re going to see wild swings in our reinsurance
buying habits one way or another unless something happens to the security.",reinsurance,Financial,0.00022442855697590858,0.29559245705604553,0.704183042049408,0.079,0.0,0.921,57.95,14.67,0.0,0.9666666666666667,30,0
RLI_1Q08.pdf,RLI,2008,1Q,"Sort of can justify the bookings or sort of signing off on the bookings of these loss ratios knowing that the
company A is so good at what it does and B surely expects to generate underwriting profit once these lines
mature.",loss ratios,Financial,0.9999459981918335,1.1803778079411131e-06,5.279892866383307e-05,0.249,0.046,0.705,45.77,19.66,0.0,0.8571428571428571,42,0
RLI_1Q10.pdf,RLI,2010,1Q,Our property facultative reinsurance unit continues to perform well.,reinsurance,Financial,1.0,2.2890178641432612e-08,7.706263183138162e-09,0.208,0.0,0.792,20.04,21.38,0.0,1.0,9,0
RLI_1Q10.pdf,RLI,2010,1Q,"As the capital markets have continued to strengthen in the first quarter, that helped to
drive our strong comprehensive earnings in book value growth.",capital markets,Financial,1.0,1.909501445851447e-09,1.8715828886683994e-09,0.399,0.0,0.601,55.58,12.93,0.0,0.875,24,1
RLI_1Q11.pdf,RLI,2011,1Q,"The CAT
rate's mixed, winds probably up a little bit and earthquake down a little bit.",earthquake,Climate,0.00026977629750035703,0.907981812953949,0.09174835681915283,0.0,0.0,1.0,80.62,8.9,0.0,0.875,16,1
RLI_1Q11.pdf,RLI,2011,1Q,"Our home office reinsurance initiative's up 22% in the quarter, that includes our crop business and some
assumed treaty business.",reinsurance,Financial,0.9992780089378357,9.085738383873831e-07,0.0007210730109363794,0.0,0.0,1.0,59.64,12.0,0.0,1.0,20,2
RLI_1Q11.pdf,RLI,2011,1Q,"The first, taking a look at your, for the quarter, your accident year loss ratios
have actually showed some improvement in most of your lines.",loss ratios,Financial,0.9999972581863403,1.7828388081397861e-06,9.448037303627643e-07,0.102,0.184,0.714,63.02,13.2,0.0,0.96,25,3
RLI_1Q11.pdf,RLI,2011,1Q,My follow-up question is regarding earthquakes.,earthquake,Climate,9.730103192850947e-05,0.014816924929618835,0.9850857257843018,0.0,0.0,1.0,48.47,9.07,0.0,1.0,6,0
RLI_1Q11.pdf,RLI,2011,1Q,"People are waking up to the fact that they're not covered for earthquakes
and they just saw a $100 billion event in Japan.",earthquake,Climate,3.6038591133547015e-06,0.0059514231979846954,0.994045078754425,0.0,0.0,1.0,81.97,9.2,0.0,1.0,23,2
RLI_1Q11.pdf,RLI,2011,1Q,"I think you’re right, I think people are -- understand that there's a possibility of
earthquakes in California.",earthquake,Climate,1.4227126484911423e-05,0.585303783416748,0.414682000875473,0.0,0.0,1.0,54.22,11.51,0.0,0.8888888888888888,18,1
RLI_1Q11.pdf,RLI,2011,1Q,"I do think rates will go up as the year progresses, as people better understand the catastrophe
risk associated with the earthquake and also the increased activity.",catastrophe,Financial,0.27909907698631287,0.01129457913339138,0.7096063494682312,0.149,0.194,0.657,35.61,16.73,0.0,0.8518518518518519,27,0
RLI_1Q11.pdf,RLI,2011,1Q,"Is that going to be a trend that we're likely going
to see as potentially reinsurance costs rise?",reinsurance,Financial,0.0050621903501451015,0.4192061424255371,0.575731635093689,0.0,0.0,1.0,70.13,11.64,0.0,0.8333333333333334,18,0
RLI_1Q11.pdf,RLI,2011,1Q,"Surety, I think, what you see there is just improved reinsurance costs on our part.
",reinsurance,Financial,0.9999994039535522,1.4530205305618438e-07,4.6096772621240234e-07,0.298,0.0,0.702,81.63,8.67,0.0,1.0,15,0
RLI_1Q11.pdf,RLI,2011,1Q,"Well, majority of our reinsurance is renewed 1-1.",reinsurance,Financial,2.42751298173971e-06,8.205312042264268e-06,0.99998939037323,0.231,0.0,0.769,46.44,13.2,0.0,1.0,8,1
RLI_1Q11.pdf,RLI,2011,1Q,I do believe reinsurance rates are going to go up.,reinsurance,Financial,0.06268921494483948,0.04768911749124527,0.8896217346191406,0.0,0.0,1.0,78.25,8.0,0.0,1.0,10,0
RLI_1Q11.pdf,RLI,2011,1Q,"We have our reinsurance operation, a little
growth there, both the facultative side and soon some treaty business.",reinsurance,Financial,0.034891825169324875,0.03576667606830597,0.9293414950370789,0.126,0.0,0.874,53.21,13.87,0.0,1.0,18,0
RLI_1Q11.pdf,RLI,2011,1Q,"When you have a catastrophe model change of this
significance, you have to look at your overall tolerances.",catastrophe,Financial,3.0794598160355235e-07,0.00044206890743225813,0.9995575547218323,0.166,0.199,0.634,61.67,13.87,0.0,0.8888888888888888,18,0
RLI_1Q11.pdf,RLI,2011,1Q,"And so it's difficult to put through
small rate increases.",rate increases,Financial,4.338066901254933e-06,0.9889113903045654,0.011084305122494698,0.0,0.236,0.764,78.25,12.0,0.0,1.0,10,0
RLI_1Q11.pdf,RLI,2011,1Q,"Do you get a sense that your clients
in general are more attuned to the catastrophe environment and, therefore, looking maybe on the margin
to buy more?",catastrophe,Financial,0.0008394572068937123,0.0129020344465971,0.9862585067749023,0.0,0.15,0.85,60.99,13.76,0.0,0.9259259259259259,27,0
RLI_1Q11.pdf,RLI,2011,1Q,"But certainly, there
is more interest in Catastrophe exposed business, given what we have witnessed over the last couple of
quarters.",catastrophe,Financial,0.0005413242615759373,0.16004350781440735,0.8394151329994202,0.232,0.245,0.523,50.16,12.21,0.0,1.0,21,1
RLI_1Q11.pdf,RLI,2011,1Q,"With respect to your Crop business, and I think it's in some respects, structured
as a reinsurance transaction.",reinsurance,Financial,6.732831820954743e-07,0.0001156861471827142,0.9998835325241089,0.278,0.0,0.722,70.13,11.64,0.0,1.0,18,0
RLI_1Q11.pdf,RLI,2011,1Q,"And then like you said, the market will allow
you, you believe -- your customers will allow you to sort of get some rate increases and that we're just
into that continuum",rate increases,Financial,0.00033554743276908994,2.673267590580508e-05,0.9996377229690552,0.178,0.0,0.822,56.93,14.98,0.0,0.84375,32,0
RLI_1Q11.pdf,RLI,2011,1Q,"So we think that, that's going
to have some impact on reinsurance rates in the future and ultimately primary rates as companies pull
that into their modeling and their underwriting.",reinsurance,Financial,0.0038664734456688166,0.01114311907440424,0.9849902987480164,0.0,0.0,1.0,41.03,20.0,0.0,0.9,30,0
RLI_1Q12.pdf,RLI,2012,1Q,"All our businesses except wind, which were
up except for wind, which was down some 8% as we manage our wind exposure down while achieving
significant rate increases and win some 30%.",rate increases,Financial,0.002041832311078906,0.9969434142112732,0.0010147001594305038,0.157,0.0,0.843,55.92,17.8,0.0,0.8125,32,2
RLI_1Q12.pdf,RLI,2012,1Q,"Our DIC earthquake business grew some 10% in the quarter, basically on rate.",earthquake,Climate,0.999993085861206,1.188223777148778e-07,6.8440094764810055e-06,0.0,0.0,1.0,66.74,8.28,0.0,1.0,13,2
RLI_1Q13.pdf,RLI,2013,1Q,"That's 2 points higher than the gross premium growth rate and is largely a result of a new Casualty
reinsurance treaty put in place 1 month",reinsurance,Financial,0.9999963045120239,1.7039049282630003e-08,3.6586573060048977e-06,0.093,0.231,0.676,62.01,15.02,0.0,0.9615384615384616,26,3
RLI_1Q13.pdf,RLI,2013,1Q,"But in this instance, the distress in the marketplace is really from a
few markets, a few carriers, exiting the business, a few MGAs not being able to keep their carrier paper
or losing their reinsurance.",reinsurance,Financial,7.595058093556872e-08,0.9999730587005615,2.6922223696601577e-05,0.0,0.205,0.795,43.4,19.96,0.0,0.7777777777777778,36,0
RLI_1Q13.pdf,RLI,2013,1Q,"You said it would
drive loss costs down in hurricane-exposed areas.",hurricane,Climate,0.000992440851405263,0.9834485054016113,0.015559121966362,0.0,0.187,0.813,68.77,8.04,0.0,1.0,11,0
RLI_1Q13.pdf,RLI,2013,1Q,"Do you mean from -- it would be that from a
reinsurance perspective?
",reinsurance,Financial,2.9767425075988285e-05,0.0019801657181233168,0.9979901313781738,0.0,0.0,1.0,84.68,11.47,0.0,0.9230769230769231,13,0
RLI_1Q13.pdf,RLI,2013,1Q,Is it assuming that hurricanes are going to go farther inland?,hurricane,Climate,8.231071115005761e-05,0.07498683035373688,0.9249308109283447,0.0,0.0,1.0,60.31,11.67,0.0,1.0,11,0
RLI_1Q13.pdf,RLI,2013,1Q,"And then I know it's not a big renewal period for reinsurance in 401, but I think
you're -- the surety and some liability lines reinsurance contracts renewed.",reinsurance,Financial,2.451956970617175e-05,0.0023889492731541395,0.9975866079330444,0.09,0.079,0.83,44.07,16.73,0.0,0.9285714285714286,28,1
RLI_1Q13.pdf,RLI,2013,1Q,"And a bit of that business is
our DIC business, California earthquake, which is seeing heightened competition as well.",earthquake,Climate,3.836462929029949e-05,0.9989814162254333,0.0009801406413316727,0.11,0.0,0.89,52.19,11.81,0.0,0.9473684210526315,19,2
RLI_1Q13.pdf,RLI,2013,1Q,"But
we're still being disciplined, so there's competition there, certainly on the hurricane side.",hurricane,Climate,0.0002988839114550501,0.8419859409332275,0.15771520137786865,0.193,0.0,0.807,48.81,14.17,0.0,1.0,14,0
RLI_1Q14.pdf,RLI,2014,1Q,"The higher net growth rate was a function of both reduced reinsurance
costs, as well as mix changes within the portfolio.
",reinsurance,Financial,0.9996733665466309,1.7705483514873777e-06,0.0003248301800340414,0.207,0.0,0.793,67.08,12.21,0.0,0.9523809523809523,21,0
RLI_1Q14.pdf,RLI,2014,1Q,"Property gross premium was down 9% although significant parts of this can be
attributed to particular lines such as marine, crop and our assumed reinsurance business.",reinsurance,Financial,5.910146683163475e-06,0.9999545812606812,3.950081008952111e-05,0.062,0.107,0.83,36.63,19.63,0.0,1.0,26,1
RLI_1Q14.pdf,RLI,2014,1Q,"And it should be no surprise given
all the attention to the alternative capital coming into the property space, the lack of the U.S. catastrophe
in '13 and the favorable reinsurance removals of 1/1.",catastrophe,Financial,0.981945812702179,0.004352697636932135,0.013701564632356167,0.121,0.206,0.673,54.22,12.68,0.0,0.8235294117647058,34,3
RLI_1Q14.pdf,RLI,2014,1Q,In regards to ceded reinsurance.,reinsurance,Financial,2.1138499505468644e-05,0.000801389804109931,0.9991775155067444,0.0,0.0,1.0,49.48,10.0,0.0,1.0,5,0
RLI_1Q14.pdf,RLI,2014,1Q,The other question I have is on the reinsurance market.,reinsurance,Financial,1.0842033589142375e-05,0.07628335058689117,0.9237058758735657,0.0,0.0,1.0,69.79,8.0,0.0,1.0,10,0
RLI_1Q14.pdf,RLI,2014,1Q,"With pricing in general coming down and more
competition from reinsurers even on the casualty side, do you see yourself utilizing that market a little bit
more, opportunity maybe to place some more business and pass it off to the reinsurers or how do you feel
that you guys are going to participate in the pricing market over the next say 2 years with reinsurance
rates coming down?
",reinsurance,Financial,0.0019065068336203694,0.17460621893405914,0.8234872817993164,0.04,0.048,0.911,10.92,31.32,0.0,0.7647058823529411,68,1
RLI_1Q14.pdf,RLI,2014,1Q,"In reinsurance purchasing, the most
important thing is the first 3 most important things are, that, that reinsurer is going to pay the loss when
it comes time to pay the loss.",reinsurance,Financial,0.00028607252170331776,0.0032303882762789726,0.996483564376831,0.114,0.202,0.683,64.38,16.55,0.0,0.75,32,2
RLI_1Q14.pdf,RLI,2014,1Q,"Way down the line,
is reinsurance pricing in my opinion and we don't participate on too much on -- or change our purchasing
habits by the pricing of reinsurance.",reinsurance,Financial,1.4573342923540622e-05,0.0011838037753477693,0.9988017082214355,0.0,0.0,1.0,59.98,15.49,0.0,0.896551724137931,29,0
RLI_1Q15.pdf,RLI,2015,1Q,"As expected, the first quarter experienced the impact of a loss of our crop reinsurance
relationship, excluding the effect of crop, gross premium would have been up 1%.",reinsurance,Financial,0.2908530831336975,0.6359612941741943,0.07318560779094696,0.0,0.178,0.822,43.06,19.77,0.0,0.8571428571428571,28,2
RLI_1Q15.pdf,RLI,2015,1Q,"With an
81 combined ratio unaffected by reserve changes or catastrophe losses, the Property segment performed
well.",catastrophe,Financial,0.9999997615814209,1.3788699959604855e-07,1.0032286468231177e-07,0.091,0.306,0.603,37.3,13.86,0.0,1.0,17,2
RLI_1Q15.pdf,RLI,2015,1Q,"But there -- these areas benefited from reinsurance cost reductions, and these savings, were quickly
translated to lower prices for our customers.",reinsurance,Financial,1.0,2.0415564350173554e-08,3.353423139174083e-08,0.0,0.118,0.882,41.7,16.02,0.0,0.9545454545454546,22,0
RLI_1Q15.pdf,RLI,2015,1Q,"The
continued reduction in our reinsurance cost gives us a little more room to compete in a market that seems
to want to continue to give up rate.",reinsurance,Financial,0.9984605312347412,0.0010115541517734528,0.0005278667667880654,0.049,0.0,0.951,59.98,16.91,0.0,0.8214285714285714,28,0
RLI_1Q15.pdf,RLI,2015,1Q,"And we believe lower reinsurance cost and benign loss cost trends continue to drive a
very competitive market.",reinsurance,Financial,0.9664065837860107,0.033485040068626404,0.00010842444316949695,0.197,0.206,0.597,53.21,13.87,0.0,0.9444444444444444,18,0
RLI_1Q15.pdf,RLI,2015,1Q,"Whether the plan to sort of deploy the savings from cheaper reinsurance into adopting a
more competitive posture.",reinsurance,Financial,0.0009378710528835654,0.005309549625962973,0.9937525391578674,0.111,0.0,0.889,53.21,11.64,0.0,0.9444444444444444,18,0
RLI_1Q15.pdf,RLI,2015,1Q,"All I'm saying is we benefited from the fact that we had
reinsurance savings.",reinsurance,Financial,0.9999997615814209,7.102215704435366e-08,7.844121086009181e-08,0.0,0.0,1.0,65.73,11.31,0.0,0.9285714285714286,14,0
RLI_1Q15.pdf,RLI,2015,1Q,"The problem is, is those reinsurance savings quickly translate into customer savings,
and frankly, that's what they should do at the end of the day.",reinsurance,Financial,0.018281828612089157,0.2644261121749878,0.7172920107841492,0.0,0.101,0.899,63.02,11.6,0.0,0.96,25,1
RLI_1Q15.pdf,RLI,2015,1Q,"Second numbers question, just were there any losses in the quarter that you're classifying as
catastrophe losses?",catastrophe,Financial,0.00014968565665185452,0.3536169230937958,0.6462333798408508,0.0,0.412,0.588,54.22,11.51,0.0,1.0,17,2
RLI_1Q15.pdf,RLI,2015,1Q,"The rate reduction, the way the SRA, the reinsurance agreement works.
",reinsurance,Financial,0.0035833430010825396,0.006430197972804308,0.9899864792823792,0.242,0.0,0.758,68.77,11.67,0.0,0.8181818181818182,11,1
RLI_1Q15.pdf,RLI,2015,1Q,"Adjusted for crop reinsurance,
our premiums were actually up a little bit.",reinsurance,Financial,0.8093666434288025,0.05256145820021629,0.13807179033756256,0.0,0.0,1.0,42.38,18.13,0.0,1.0,12,0
RLI_1Q15.pdf,RLI,2015,1Q,"It's driving pricing lower, especially on
the low-hanging fruit, like CAT insurance, catastrophe insurance.",catastrophe,Financial,0.00012957036960870028,0.9972484707832336,0.0026218879502266645,0.124,0.328,0.547,31.89,14.17,0.0,1.0,14,1
RLI_1Q15.pdf,RLI,2015,1Q,That's wind and earthquake.,earthquake,Climate,1.8390711602478405e-06,0.0013321624137461185,0.9986660480499268,0.0,0.0,1.0,92.8,1.6,0.0,1.0,4,0
RLI_1Q16.pdf,RLI,2016,1Q,"Excluding the discontinued crop and facultative reinsurance business
that we previously reported, the segment was down 7%, which is attributable mostly to continued soft
market conditions in catastrophe-exposed areas.",catastrophe,Financial,2.8534296347970667e-07,0.9999994039535522,2.7151406811753986e-07,0.0,0.0,1.0,-0.27,25.39,0.0,0.9655172413793104,29,1
RLI_1Q16.pdf,RLI,2016,1Q,"Removing the impact of crop and the facultative
reinsurance business that we exited last year, we were up 5%.",reinsurance,Financial,0.9999046325683594,5.473209057527129e-06,8.989675552584231e-05,0.0,0.0,1.0,52.19,16.02,0.0,0.8947368421052632,19,2
RLI_1Q16.pdf,RLI,2016,1Q,"Rate increases are very difficult to come by, and we see casualty rates as flat overall, but we continue
to see positive rate on most wheels-based business and in a smaller-count professional liability space.
",rate increases,Financial,0.9999994039535522,3.107374482169689e-07,2.758518746759364e-07,0.122,0.157,0.721,28.51,21.84,0.0,0.8823529411764706,34,0
RLI_1Q16.pdf,RLI,2016,1Q,"Declining reinsurance rates and a better spread of risk have helped us take some of
the pressure off our returns in the bottom line, but this is not a growth business for us until the underlying
economics change.
",reinsurance,Financial,0.9999998807907104,1.0041476627975499e-07,1.4002415227309939e-08,0.049,0.149,0.802,49.83,19.41,0.0,0.868421052631579,38,0
RLI_1Q17.pdf,RLI,2017,1Q,"Gross written premiums were down about 1% in the quarter, reflecting a
challenging market and our previous announcement to curtail our rating of property treaty reinsurance
and recreational vehicle businesses.
",reinsurance,Financial,6.866420676487905e-08,0.9999998807907104,4.848494228326672e-08,0.05,0.098,0.852,24.11,25.33,0.0,0.9333333333333333,30,2
RLI_1Q17.pdf,RLI,2017,1Q,"This product has achieved rate increases every year since 2011, and we were able to achieve an 11% rate
increase this past quarter.",rate increases,Financial,1.0,4.7393400315343115e-09,8.040589527524844e-09,0.095,0.0,0.905,73.51,10.94,0.0,0.9565217391304348,23,4
RLI_1Q17.pdf,RLI,2017,1Q,"This segment reflects a couple of underperforming businesses we began exiting late last year, including
recreational vehicles and treaty catastrophe.",catastrophe,Financial,3.1568297345074825e-06,0.9690843224525452,0.03091254085302353,0.0,0.196,0.804,17.34,22.0,0.0,1.0,20,1
RLI_1Q17.pdf,RLI,2017,1Q,"The catastrophe-related businesses continue to be under rate pressure, albeit, slightly
smaller decreases than we experienced the last several years.
",catastrophe,Financial,0.0007423248025588691,0.9992412328720093,1.6446434528916143e-05,0.0,0.104,0.896,17.34,20.0,0.0,1.0,20,1
RLI_1Q17.pdf,RLI,2017,1Q,"The exit of several businesses plus continued rate pressure on catastrophe-related business is exerting
expense ratio pressures on this segment.",catastrophe,Financial,0.00010994975309586152,0.9998893737792969,6.393830744855222e-07,0.0,0.2,0.8,17.34,18.0,0.0,0.95,20,0
RLI_1Q17.pdf,RLI,2017,1Q,"We put that into our plan and to our quarter's loss ratios, certainly the current
loss ratios.
",loss ratios,Financial,1.1695423381752335e-05,0.0003670335572678596,0.9996212720870972,0.114,0.219,0.667,71.14,6.8,0.0,0.8823529411764706,17,1
RLI_1Q18.pdf,RLI,2018,1Q,"Rate increases continue in this line, with renewals up 9%.
",rate increases,Financial,0.9999879598617554,6.347080017121698e-08,1.1946136510232463e-05,0.0,0.0,1.0,69.79,12.0,0.0,1.0,10,1
RLI_1Q18.pdf,RLI,2018,1Q,"Both the earthquake
and wind products grew by over 30%.
",earthquake,Climate,0.9999998807907104,5.830020910480016e-09,1.6089968823962408e-07,0.0,0.0,1.0,95.17,4.0,0.0,1.0,10,1
RLI_1Q18.pdf,RLI,2018,1Q,Other than -- I think I mentioned hurricane wind pricing is up -- continues to be up.,hurricane,Climate,0.9873034358024597,0.0007774197147227824,0.011919127777218819,0.0,0.0,1.0,64.71,11.33,0.0,0.8823529411764706,17,0
RLI_1Q18.pdf,RLI,2018,1Q,"And then our investment in Prime, which we have
a reinsurance arrangement -- a quarter share arrangement with them.",reinsurance,Financial,1.7183820943955652e-07,8.34186084830435e-06,0.9999915361404419,0.121,0.0,0.879,61.67,13.87,0.0,0.8947368421052632,19,0
RLI_1Q18.pdf,RLI,2018,1Q,"And that's applied
both to hurricane and to earthquake.",hurricane,Climate,3.993714472017018e-06,0.0047168368473649025,0.9952791929244995,0.0,0.0,1.0,79.26,8.04,0.0,0.8888888888888888,9,0
RLI_1Q18.pdf,RLI,2018,1Q,"Now on renewals, earthquake is still tougher.",earthquake,Climate,4.932576484861784e-05,0.9879347085952759,0.012015999294817448,0.221,0.0,0.779,89.75,2.8,0.0,1.0,7,0
RLI_1Q18.pdf,RLI,2018,1Q,"It's still tougher to get
rate on earthquake.",earthquake,Climate,0.00040566042298451066,0.17802998423576355,0.8215643167495728,0.195,0.0,0.805,105.66,3.2,0.0,1.0,8,0
RLI_1Q18.pdf,RLI,2018,1Q,"And the brokers attribute that there was -- there obviously was
some hurricane activity that woke people up to the exposure that you can have if you have a catastrophe
loss, even though it was wind not quake.",catastrophe,Financial,2.5068156901397742e-06,0.9998993873596191,9.8095515568275e-05,0.0,0.161,0.839,50.84,20.21,0.0,0.7894736842105263,38,0
RLI_1Q18.pdf,RLI,2018,1Q,"There also was a Mexican earthquake last year that apparently
has created some more awareness.",earthquake,Climate,0.0010062813526019454,0.6296610832214355,0.3693326413631439,0.133,0.0,0.867,47.79,14.0,0.0,1.0,15,2
RLI_1Q18.pdf,RLI,2018,1Q,So we -- I think we reported about 9% renewal rate increases.,rate increases,Financial,0.9941744208335876,3.4668962598516373e-06,0.0058221472427248955,0.0,0.0,1.0,68.77,15.31,0.0,0.9166666666666666,12,1
RLI_1Q19.pdf,RLI,2019,1Q,"Also from a storm perspective, there was a minimal amount of loss in
the quarter, about $1 million, and loss estimates for both 2017 and 2018 hurricanes remained unchanged.
",hurricane,Climate,0.00014529324835166335,0.016702376306056976,0.9831522703170776,0.0,0.155,0.845,58.96,17.12,0.0,0.896551724137931,29,4
RLI_1Q19.pdf,RLI,2019,1Q,"Our catastrophe business was down 5% on the top line for the quarter, while rates were up about 5%
for wind and nearly flat for quake.",catastrophe,Financial,1.8633014406077564e-05,0.9994353652000427,0.0005459290114231408,0.06,0.146,0.795,78.93,11.94,0.0,0.8461538461538461,26,3
RLI_1Q19.pdf,RLI,2019,1Q,"As you are aware, there were several significant catastrophe events
that occurred over the last 2 years, including hurricanes, earthquakes, floods, wildfires and even volcanic
eruptions.",catastrophe,Financial,1.4084284885029774e-05,0.6767895221710205,0.3231963813304901,0.062,0.151,0.788,45.09,16.55,0.0,1.0,26,1
RLI_1Q19.pdf,RLI,2019,1Q,"So just
want to get a feeling of how sustainable those rate increases are?",rate increases,Financial,0.026626503095030785,0.04843897745013237,0.924934446811676,0.219,0.0,0.781,74.19,11.31,0.0,1.0,14,0
RLI_1Q19.pdf,RLI,2019,1Q,"And the other places kind of
have remained pretty stable as far as the increases, but those are relatively low single-digit rate increases
that we're seeing, not -- nothing really out of the ordinary or anything out of what we've seen in the past.
",rate increases,Financial,0.6377045512199402,0.002021855441853404,0.3602735698223114,0.078,0.056,0.866,36.29,19.99,0.0,0.8409090909090909,44,0
RLI_1Q19.pdf,RLI,2019,1Q,"Well, we have different loss ratios for different commercial umbrella products, so I wouldn't say that's
necessarily true.",loss ratios,Financial,3.8662919905618764e-06,4.6460616431431845e-05,0.9999496936798096,0.231,0.108,0.66,36.28,11.64,0.0,0.9444444444444444,18,0
RLI_1Q19.pdf,RLI,2019,1Q,We would look at longer-term loss ratios and the pricing we're getting.,loss ratios,Financial,3.383978537385701e-07,2.017956467170734e-05,0.9999794960021973,0.0,0.173,0.827,84.68,4.8,0.0,1.0,12,0
RLI_1Q19.pdf,RLI,2019,1Q,"We do utilize reinsurance a little bit more
there.",reinsurance,Financial,2.610019009807729e-06,4.835888830712065e-05,0.9999489784240723,0.0,0.0,1.0,79.26,8.04,0.0,1.0,9,0
