title,link,snippet,date,category
Travelers Motel - Google hotels,https://www.google.com/travel/hotels/%E8%A9%B9%E9%87%91%E6%96%AF-hotels/entity/ChcIseXv3v-a9uJ1GgsvZy8xd2YyMmp0ZxAB?utm_campaign=sharing&utm_medium=link&utm_source=htls&ts=CAEaIAoCGgASGhIUCgcI6A8QAhgWEgcI6A8QAhgXGAEyAhAAKgkKBToDVVNEGgA&ved=2ahUKEwi4n6re1LGEAxUPR6sCHSchB10QyvcEegQIBBBP&rp=OAHCAgIiAA,"Nestled in the forested village of Onekama and within view of Portage Lake and Lake Michigan, Travelers Motel offers clean, comfortable rooms with a sleek ...",2025-01-03,Travelers
Travelers Inn - Google hotels,https://www.google.com/travel/hotels/entity/ChgI_s7Lqdms2Mf_ARoLL2cvMXRjeHFkMjkQAQ?ei=0HRcZtL8GYOOrcUP_q-PuAs&sa=X&ved=2ahUKEwjSpMWrhL2GAxUDR6sCHf7XA7cQyfcEegUIBBCeAQ,Travelers Inn offers great prices on hotel stays for those looking to get away for the weekend or just a quaint and quiet stay. Our family-run motel .,2025-01-03,Travelers
Travelers Among Mountains and Streams - Fan Kuan — Google Arts ...,https://www.google.com/culturalinstitute/asset-viewer/WAHwkSr8lMK0uA?projectId=art-project&hl=es,Travelers Among Mountains and Streams. Fan KuanSong Dynasty (10th Century) - Song Dynasty (Early 11th Century). Recomendaciones.,2025-01-03,Travelers
Travelers Companies Inc (TRV) Stock Price & News - Google Finance,https://www.google.com/finance/quote/TRV:NYSE,"The Travelers Companies, Inc., commonly known as Travelers, is an American insurance company. It is the second-largest writer of US commercial property ...",2025-01-03,Travelers
Find Cheap Flights Options to Wareham - Google Flights,https://www.google.com/travel/flights/flights-to-wareham.html,"However, Southampton Airport is more popular with travelers. How can I find last-minute flight deals to Wareham? Finding last-minute flights to Wareham is ...",2025-01-03,Travelers
Find Cheap Flights Options to Pomona - Google Flights,https://www.google.com/travel/flights/flights-to-pomona.html,"However, Los Angeles International Airport is more popular with travelers. How can I find last-minute flight deals to Pomona? Finding last-minute flights to ...",2025-01-03,Travelers
Find Cheap Flights from Toronto - Google Flights,https://www.google.com/travel/flights/flights-from-toronto.html,"However, Toronto Pearson International Airport is more popular with travelers. How long before a flight should I arrive at the airport in Toronto ? It's ...",2025-01-03,Travelers
Google Sustainability: Sustainable Innovation & Technology,https://www.google.com/green/,"It's not always possible to avoid flying, but consider which flights you take—some flights pollute less than others. 71%. Percentage of surveyed travelers ...",2025-01-03,Travelers
Find Cheap Flights Options to Rijeka - Google Flights,https://www.google.com/travel/flights/flights-to-rijeka.html?gl=AU&hl=en,Airports are listed based on distance from Rijeka center and popularity with travelers. Franjo Tuđman International Airport Zagreb (ZAG). Zagreb 1 hr 50 min ...,2025-01-03,Travelers
Find Cheap Flights from Nantes - Google Flights,https://www.google.com/travel/flights/flights-from-nantes.html?gl=AU&hl=en,... to the city center. Airports are listed based on distance from Nantes center and popularity with travelers. Nantes Atlantique Airport (NTE). Nantes 22 min 7 km.,2025-01-03,Travelers
